,Source,link_leicht,URL,sents_leicht,sents_standard
1075,P_manually,,zwischenbericht,Mit den Erwachsenen kann man auch über Probleme reden. Mit den Jugendlichen auch.,"Das Projekt möchte einen Beitrag dazu leisten, dass sich die Interessen und Bedürfnisse junger Menschen mit Beeinträchtigung in den Angeboten der Kinder- und Jugendarbeit wiederfinden."
1076,P_manually,,zwischenbericht,Mitbestimmung von Jugendlichen,15. Kinder- und Jugendbericht der Bundesregierung
1077,P_manually,,zwischenbericht,"In der Jugend-Arbeit werden Jugendliche gefragt, was sie machen wollen.",Das sind die Zielgruppen Im Mittelpunkt des Projektes stehen Jugendliche mit sogenannter geistiger Behinderung von 12 bis 18 Jahren.
1078,P_manually,,zwischenbericht,"Jugendliche können mitentscheiden, welche Angebote gemacht werden.","Um ein umfassendes Bild zu gewinnen, ist eine weitere Zielgruppe wichtig: die Menschen, die die verschiedenen Angebote für Jugendliche in den Lebenshilfen durchführen oder in Entscheidungsfunktionen arbeiten."
1079,P_manually,,zwischenbericht,"So gibt es Angebote, die den Jugendlichen gefallen. Viele Kinder und Jugendliche nutzen auch die Angebote der Behinderten-Hilfe.","So kann ermittelt werden, wie bereits jetzt die Angebote für junge Menschen mit Behinderung aussehen. Weiterhin richtet sich das Projekt an Einrichtungen und Träger der Kinder- und Jugendarbeit nach Sozialgesetzbuch acht (SGB VIII §11 und §12), wie zum Beispiel Jugendverbände oder Offene Kinder- und Jugendeinrichtungen."
1080,P_manually,,zwischenbericht,Zum Beispiel: den Familien- Unterstützenden-Dienst. Das heißt: Eine Person kommt zu den Jugendlichen.,Unser Ziel ist ein Dialog mit den Fachkräften aus der Behindertenhilfe und Kinder- und Jugendarbeit zu den Interessen und Bedürfnissen der Jugendlichen.
1081,P_manually,,zwischenbericht,Gemeinsam machen sie etwas. Zum Beispiel: Sie gehen gemeinsam ins Kino. Oder sie besuchen zusammen mit anderen Jugendlichen andere Angebote.,So können nachhaltige Kooperationen entstehen um Kinder- und Jugendarbeit gemeinsam inklusiver zu gestalten.
1082,P_manually,,zwischenbericht,Die Probleme,Das sind die Ziele des Projektes
1083,P_manually,,zwischenbericht,Die Lebenshilfe weiß nicht: ob Jugendliche mit Beeinträchtigung die Angebote gut finden.,"Mit dem Projekt wollen wir erreichen, dass..."
1084,P_manually,,zwischenbericht,"ob Jugendliche mit Beeinträchtigung gefragt werden, was sie machen wollen. was sich Jugendliche wünschen.",wir Erkenntnisse über Interessen und Wünsche von Jugendlichen mit geistiger Behinderung zu Angeboten der Kinder- und Jugendarbeit gewinnen.
1085,P_manually,,zwischenbericht,Das will die Lebenshilfe mit dem Projekt ändern. Welche Ziele hat das Projekt?,Das Projekt will Wissenslücken schließen. Angebote der Kinder- und Jugendarbeit an Interessen und Lebenslagen von Jugendlichen mit Behinderung anknüpfen.
1086,P_manually,,zwischenbericht,Es gibt viele Angebote für Jugendliche. Aber sind das die richtigen Angebote? Das wissen wir nicht.,Kinder- und Jugendarbeit ihrem Inklusions-Auftrag fundiert nachkommen kann.
1087,P_manually,,zwischenbericht,Wir wollen wissen: Was Jugendliche mit Beeinträchtigung sich in ihrer Freizeit wünschen.,Jugendliche mit sogenannter geistiger Behinderung in ihrer Vielfalt an Angeboten der Kinder- und Jugendarbeit gemäß ihren Interessen und Bedürfnissen teilhaben. neue Kooperationen von Trägern der Kinder- und Jugendarbeit und der Behindertenhilfe/Lebenshilfe entstehen.
1088,P_manually,,zwischenbericht,"Das sollen dann alle erfahren. Besonders die Menschen,",So können sich diese beiden Systeme aneinander annähern und im Sinne ihrer Adressat*innen zusammenwirken.
1089,P_manually,,zwischenbericht,die mit Jugendlichen arbeiten. Und die Menschen in der Behinderten-Hilfe.,Akteure aus der Kinder- und Jugendarbeit sowie Behindertenhilfe Handwerkszeug in Form einer Handreichung erhalten.
1090,P_manually,,zwischenbericht,"Damit die Jugendlichen die Angebote bekommen,","So können sie Ideen zur Gestaltung inklusiver Angebote bekommen. Akteur*innen aus der Kinder- und Jugendarbeit sowie Behindertenhilfe befähigt und inspiriert werden, bedarfsgerechte inklusive Angebote zu entwickeln und umzusetzen."
1091,P_manually,,zwischenbericht,die sie gut finden.,auch junge Menschen mit sogenannter geistiger Behinderung mitgestalten und entscheiden.
1092,P_manually,,zwischenbericht,Wer macht bei dem Projekt mit? Die Lebenshilfe macht das Projekt zusammen mit Partnern.,Dossier: Inklusion in der Kinder- und Jugendarbeit Selbstbestimmung stärken und die Teilhabe aller ermöglichen: Ein Dossier der Bundesvereinigung Lebenshilfe in Kooperation mit dem Deutschen Bundesjugendring.
1093,P_manually,,zwischenbericht,Bei dem Projekt machen auch 2 Hochschulen mit.,Blick in die inklusive Praxis
1094,P_manually,,zwischenbericht,Eine Hoch-Schule ist eine Schule für Erwachsene.,FIETe steht für Freizeit = Inklusion.
1095,P_manually,,zwischenbericht,Es machen auch 3 Lebenshilfen mit: Lebenshilfe Hamburg Lebenshilfe Heidelberg,Engagement. Teilhabe erleben.
1096,P_manually,,zwischenbericht,Lebenshilfe Ostholstein,FIETe ist ein Projekt der Lebenshilfe Ostholstein.
1097,P_manually,,zwischenbericht,Was wird an den Standorten genau gemacht?,Es wurde durch die Aktion Mensch gefördert.
1098,P_manually,,zwischenbericht,Die Hochschulen fragen Jugendliche:,"Ziel des Projektes war es, herauszufinden, wie inklusive Jugendarbeit funktioniert."
1099,P_manually,,zwischenbericht,Welche Angebote wünscht ihr euch?,"Und das hat geklappt! In den drei Jahren entstanden großartige Angebote inklusiver Jugendarbeit in Kooperation verschiedener Akteure aus der Kinder- und Jugendarbeit. Jugendliche mit und ohne Behinderung konnten mitbestimmen, sich beteiligen und aktiv dabei sein, inklusive Angebote zu gestalten und bei ihnen mitzumachen. Ein inklusives Angebot war das Erstellen von Lichtbox-Videos zum Thema Inklusion."
1100,P_manually,,zwischenbericht,Sie sollen über ihre Freizeit erzählen.,In diesem Angebot konnten die Jugendlichen ihre Interessen und Fähigkeiten in der Videoerstellung einbringen.
1101,P_manually,,zwischenbericht,Zum Beispiel: Was brauchst du?,Sind Sie neugierig? Hier können Sie ein Video ansehen.
1102,P_manually,,zwischenbericht,Was wünscht du dir? Was gefällt dir? Was machst du gerne?,Näheres zu den tollen inklusiven Ideen und dem Projekt finden Sie hier. Video aus dem inklusiven Projekt der Lebenshilfe Ostholstein.
1103,P_manually,,zwischenbericht,Die Jugendlichen entscheiden: Wo die Befragungen gemacht werden.,"Lichtbox-Videos: In Kleingruppen wurden mit Jugendlichen sogenannte Lichtbox-Videos zum Thema Inklusion erstellt. Leitmotiv ist der fiktive, barrierefreie Ort Inkluhausen."
1104,P_manually,,zwischenbericht,Zum Beispiel: in der Schule oder Zuhause.,Dieses Format bietet unterschiedlichste Beteiligungsmöglichkeiten. Teilnehmer*innen können das Bühnenbild gestalten und kreative Ideen beisteuern. Technikaffine kümmern sich zum Beispiel um das Licht und die Aufnahmen. Im ersten Video wird gefragt: Wie weit ist es noch bis Inkluhausen und kommen wir schnell voran oder eher im Schneckentempo?
1105,P_manually,,zwischenbericht,Das wollen wir wissen:,"Der zweite Film zeigt Barrieren im Alltag. Ein Friseurladen mit dem Schild „Come in, we are open“ verhindert zum Beispiel durch Eingangsstufen den Zugang für eine Rollstuhlfahrerin. Im dritten Video geht es um einen Schulausflug in den Wald. Ein Kind im Rollstuhl langweilt sich, weil es nicht mitmachen kann."
1106,P_manually,,zwischenbericht,Was brauchen Jugendliche?,"Die Empfehlung am Ende: Das Kind muss bei der Planung einbezogen sein und mitreden können, damit Ausflüge für alle gut sind. Modellprojekt „Zusammen? Geht doch!“ Ein Grundprinzip der Kinder- und Jugendarbeit ist es, offen für Alle zu sein."
1107,P_manually,,zwischenbericht,Was wünschen sich Jugendliche?,"Mit dem Modellprojekt „Zusammen? Geht doch!“ lotet die Arbeitsgemeinschaft der Evangelischen Jugend in Deutschland (aej) neue Angebote und neue Kooperationsformen für eine inklusive Kinder- und Jugendarbeit aus. Akteur*innen der Evangelischen Jugend und der Behindertenhilfe lernen im Projekt voneinander, öffnen ihre Strukturen wechselseitig, erarbeiten gemeinsame Konzepte für stabile Kooperationsformen und erproben diese praktisch. An vier Projektstandorten finden unter anderem regelmäßige gemeinsame Gruppenangebote statt, Ferienfreizeiten werden geplant und Konzepte für inklusive Juleica-Schulungen entwickelt und durchgeführt."
1108,P_manually,,zwischenbericht,Was gefällt Jugendlichen?,"Die Jugendleiter*in-Card (Juleica) ist der bundesweit einheitliche Ausweis für ehrenamtliche Mitarbeiter*innen in der Jugendarbeit. Ehrenamtliche haben damit die Berechtigung, in der Kinder- und Jugendarbeit tätig zu sein. Kindern und Jugendlichen mit und ohne Behinderung wird damit die gemeinsame Teilhabe ermöglicht. Erfahrungen, Methoden, Konzepte und Ideen, die dadurch entstehen, werden als Materialpool für die Kinder- und Jugendarbeit verschriftlicht und veröffentlicht."
1109,P_manually,,zwischenbericht,Durch Wahlen können Menschen mit-bestimmen.,
1110,P_manually,,zwischenbericht,Zum Beispiel im Werkstatt-Rat.,
1111,P_manually,,zwischenbericht,Und in der Politik.,
1112,P_manually,,zwischenbericht,In diesem Text steht:,
1113,P_manually,,zwischenbericht,Was Wahlen genau sind.,
1114,P_manually,,zwischenbericht,Und wie Sie wählen können.,
1115,P_manually,,zwischenbericht,Warum gibt es Wahlen?,
1116,P_manually,,zwischenbericht,Betreute treffen selbst Entscheidungen.,
1117,P_manually,,zwischenbericht,© Reinhild Kassing,
1118,P_manually,,zwischenbericht,"Wahlen sind wichtig. Im Alltag entscheidet oft jeder selbst: Das mache ich und so soll es sein. Aber wenn viele Menschen entscheiden,",In Deutschland gilt Inklusives Wahlrecht für alle Menschen.
1119,P_manually,,zwischenbericht,ist das schwerer.,
1120,P_manually,,zwischenbericht,"Denn viele Menschen haben viele Meinungen. Bei Wahlen ist jede Meinung wichtig. Nur wer wählt, kann mit-bestimmen.",Jeder Mensch hat das Recht zu wählen.
1121,P_manually,,zwischenbericht,Auch Selbstvertreter bestimmen mit.,
1122,P_manually,,zwischenbericht,Selbstvertretung heißt: Ich setze mich für meine Bedürfnisse ein. Es gibt viele verschiedene Wahlen. In der Schule: Jede Klasse wählt einen Klassen-Sprecher.,Jede Stimme hat den gleichen Wert.
1123,P_manually,,zwischenbericht,In der Werkstatt: Die Beschäftigten wählen den Werkstatt-Rat,
1124,P_manually,,zwischenbericht,und die Frauen-Beauftragte. In der Politik: Die Menschen in Deutschland wählen den Landtag und den Bundestag. Wahlen in der Politik Wir leben in einer Demokratie.,Hier gibt es weitere Informationen zum Wahlrecht und zu Wahlen.
1125,P_manually,,zwischenbericht,In einer Demokratie bestimmt das Volk.,
1126,P_manually,,zwischenbericht,Alle Menschen in einem Land sind das Volk.,
1127,P_manually,,zwischenbericht,Es können aber nicht alle Menschen immer alles bestimmen. Das ist zu schwierig. Weil es zu viele Menschen sind.,Warum sind Wahlen wichtig?
1128,P_manually,,zwischenbericht,Darum gibt es Politiker und Politikerinnen. Sie vertreten die Meinung der Menschen. Deshalb kann man sie wählen. Dann gehen sie als Abgeordnete in den Bundestag.,Deutschland ist ein aus 16 Ländern bestehender Bundesstaat und eine parlamentarische Demokratie.
1129,P_manually,,zwischenbericht,"Dort bestimmen sie,",
1130,P_manually,,zwischenbericht,was gemacht wird.,
1131,P_manually,,zwischenbericht,"Wahlen sind also sehr wichtig. Weil eine Wahl entscheidet, wer Politik machen darf. Was bringt Wählen?",Wahlen sind die Grundpfeiler einer Demokratie – aber was heißt das eigentlich?
1132,P_manually,,zwischenbericht,"Ein Erklär-Film in Leichter Sprache von Tacheles, dem inklusiven Medien-Team der Lebenshilfe Trier.",
1133,P_manually,,zwischenbericht,"Welche Wahlen gibt es? Die Politik regelt das Zusammen-Leben. Die Menschen entscheiden, wer die Politik macht.",Wie in Deutschland gewählt wird
1134,P_manually,,zwischenbericht,Das machen die Menschen durch Wahlen.,
1135,P_manually,,zwischenbericht,In einer Demokratie gibt es verschiedene Wahlen.,
1136,P_manually,,zwischenbericht,Welche Wahlen gibt es?,
1137,P_manually,,zwischenbericht,Zum Beispiel gibt es:,
1138,P_manually,,zwischenbericht,Europa-Wahl Bundestags-Wahl Landtags-Wahl Kommunal-Wahl,Wahl der Abgeordneten
1139,P_manually,,zwischenbericht,Europa-Wahl: Was ist das? Die Europa-Wahl entscheidet: Diese Politiker dürfen in das Europa-Parlament. Das Europa-Parlament macht viele Gesetze und Regeln.,"Bei einer Wahl entscheiden die Menschen nicht direkt über politische Fragen, sondern sie entscheiden sich für Abgeordnete."
1140,P_manually,,zwischenbericht,Sie gelten für ganz Europa.,
1141,P_manually,,zwischenbericht,Also auch für Deutschland.,
1142,P_manually,,zwischenbericht,Die Europa-Wahlen sind alle 5 Jahre.,
1143,P_manually,,zwischenbericht,Bundestags-Wahl: Was ist das? Die Bundestags-Wahl entscheidet: Diese Politiker dürfen in den Bundestag. Der Bundestag macht viele Gesetze und Regeln.,Diese Abgeordneten oder auch Volksvertreter*innen entscheiden dann ohne Weisung nach eigenem Gewissen (freies Mandat).
1144,P_manually,,zwischenbericht,Sie gelten für ganz Deutschland.,
1145,P_manually,,zwischenbericht,Der Bundestag wählt den Bundes-Kanzler.,
1146,P_manually,,zwischenbericht,Oder die Bundes-Kanzlerin.,
1147,P_manually,,zwischenbericht,"Der Bundestag entscheidet,",
1148,P_manually,,zwischenbericht,wieviel Geld ausgegeben wird.,
1149,P_manually,,zwischenbericht,Zum Beispiel für Schulen und Straßen. Der Bundestag macht auch Verträge mit anderen Ländern. Zum Beispiel die UN-Behinderten-Rechts-Konvention. Das ist ein Vertrag über die Rechte von Menschen mit Behindeurng.,"Sie vertreten die Menschen des Landes – zusammengeschlossen in Fraktionen – in der Volksvertretung, dem sogenannten Parlament."
1150,P_manually,,zwischenbericht,Kurz sagt man auch: UN-BRK.,
1151,P_manually,,zwischenbericht,Die Bundestags-Wahl ist alle 4 Jahre. Landtags-Wahl: Was ist das? Deutschland hat 16 Bundes-Länder. Jedes Bundes-Land hat einen eigenen Landtag.,Fraktionen im Bundestag
1152,P_manually,,zwischenbericht,Die Landtags-Wahl entscheidet:,
1153,P_manually,,zwischenbericht,Diese Politiker und Politikerinnen dürfen in den Landtag.,
1154,P_manually,,zwischenbericht,Der Landtag macht viele Gesetze und Regeln.,
1155,P_manually,,zwischenbericht,Sie gelten nur für das eine Bundesland.,
1156,P_manually,,zwischenbericht,Die Landtags-Wahl ist meist alle 5 Jahre.,
1157,P_manually,,zwischenbericht,Kommunal-Wahl: Was ist das?,
1158,P_manually,,zwischenbericht,Kommunal bedeutet:,
1159,P_manually,,zwischenbericht,"Es geht um eine Stadt, eine Gemeinde oder einen Land-Kreis.",
1160,P_manually,,zwischenbericht,"Ein Land-Kreis besteht oft aus mehreren Städten oder Gemeinden. Die Kommunal-Wahl entscheidet: Welche Menschen: im Stadt-Rat,","Je mehr Stimmen eine Fraktion bei einer Wahl erhält, desto stärker ist ihre Position im Parlament."
1161,P_manually,,zwischenbericht,Gemeinde-Rat,
1162,P_manually,,zwischenbericht,oder Kreistag arbeiten dürfen.,
1163,P_manually,,zwischenbericht,Das sind zum Beispiel:,
1164,P_manually,,zwischenbericht,"der Bürger-Meister oder die Bürger-Meisterin,",
1165,P_manually,,zwischenbericht,der Land-Rat oder die Land-Rätin.,
1166,P_manually,,zwischenbericht,Sie entscheiden:,
1167,P_manually,,zwischenbericht,"Das ist für die Stadt, Gemeinde oder den Land-Kreis wichtig.",
1168,P_manually,,zwischenbericht,Wer darf wählen?,
1169,P_manually,,zwischenbericht,Seit dem Jahr 2019 gilt für alle Wahlen:,
1170,P_manually,,zwischenbericht,Auch Menschen mit einer,
1171,P_manually,,zwischenbericht,"Betreuung in allen Angelegenheiten dürfen wählen. Jeder darf selbst entscheiden, ob er wählen möchte.",Darum ist jede einzelne Stimme (oder auch Wahlbeteiligung) bei einer Wahl sehr wichtig.
1172,P_manually,,zwischenbericht,Und wen er wählen möchte.,
1173,P_manually,,zwischenbericht,Wer darf bei der Bundestags-Wahl wählen?,
1174,P_manually,,zwischenbericht,Bürger und Bürgerinnen:,
1175,P_manually,,zwischenbericht,über 18 Jahre,
1176,P_manually,,zwischenbericht,"mit einem deutschen Pass Wer darf bei der Landtags-Wahl wählen? Bürger und Bürgerinnen: über 18 Jahre oder über 16 Jahre,","Diese Fraktionen sind aktuell im Parlament, dem Bundestag, vertreten:"
1177,P_manually,,zwischenbericht,"mit einem deutschen Pass,",
1178,P_manually,,zwischenbericht,die schon 1 bis 3 Monate in dem Bundes-Land wohnen.,
1179,P_manually,,zwischenbericht,Für Landtags-Wahlen gibt es unterschiedliche Regeln.,
1180,P_manually,,zwischenbericht,Je nach Bundes-Land.,
1181,P_manually,,zwischenbericht,Wer darf bei der Kommunal-Wahl wählen?,
1182,P_manually,,zwischenbericht,"Bürger und Bürgerinnen: über 18 Jahre oder über 16 Jahre, mit einem deutschen Pass oder einem Pass aus der Europäischen Union, die schon 1 bis 3 Monate in dem Land-Kreis wohnen.",CDU/CSU
1183,P_manually,,zwischenbericht,Für Kommunal-Wahlen gibt es unterschiedliche Regeln. Je nach Bundes-Land. Wer wird gewählt? Das gilt bei der Bundestags-Wahl,SPD
1184,P_manually,,zwischenbericht,oder bei der Landtags-Wahl:,
1185,P_manually,,zwischenbericht,Es werden Personen und Parteien gewählt.,
1186,P_manually,,zwischenbericht,Die Wähler haben manchmal zwei Stimmen.,
1187,P_manually,,zwischenbericht,Das bedeutet:,
1188,P_manually,,zwischenbericht,Jeder darf zwei Kreuze,
1189,P_manually,,zwischenbericht,auf dem Stimm-Zettel machen.,
1190,P_manually,,zwischenbericht,Eine Stimme ist für eine Person aus dem eigenen Wahl-Kreis. Die andere Stimme ist für eine Partei. Jeder wählt also eine Person und eine Partei.,AfD
1191,P_manually,,zwischenbericht,Das gilt für Kommunal-Wahlen: Es werden einzelne Personen gewählt. Nach einer Wahl werden Stimmen gezählt. Das heißt:,FDP
1192,P_manually,,zwischenbericht,Es werden die Kreuze auf allen gültigen Stimm-Zetteln gezählt.,Die Linke
1193,P_manually,,zwischenbericht,"Wer die meisten Stimmen bekommen hat, gewinnt die Wahl. Was sind Erst- und Zweit-Stimme? Ein Erklär-Film in Leichter Sprache von Tacheles, dem inklusiven Medien-Team der Lebenshilfe Trier.",Bündnis 90/Die Grünen
1194,P_manually,,zwischenbericht,Wahl-Kampf – was ist das? Parteien wollen gewählt werden. Eine Partei ist eine Gruppe,"Jede Fraktion hat eine eigene politische Ausrichtung, obwohl es auch Überschneidungen gibt."
1195,P_manually,,zwischenbericht,von Politikerinnen und Politikern. Menschen in einer Partei haben oft ähnliche Ideen und Ziele.,"Vor einer Wahl sollte sich jede Wählerin und jeder Wähler darüber informieren, welche Fraktion sie oder ihn im Parlament am besten vertreten würde."
1196,P_manually,,zwischenbericht,Bei Wahlen kann man verschiedene Parteien oder Personen wählen. Alle wollen viele Stimmen bekommen.,Hinweis: Die Bildung von Fraktionen im Parlament unterliegt Regeln und bietet verschiedene Vorteile.
1197,P_manually,,zwischenbericht,Das heißt: Ein Kreuz für sie auf vielen Wahl-Zetteln. Alle wollen die Wahl gewinnen. Deshalb machen sie Wahl-Kampf.,"In der Regel bilden sich Fraktionen durch Abgeordnete einer einzelnen Partei heraus, die dann die Ziele der Partei über die Fraktion in das Parlament tragen."
1198,P_manually,,zwischenbericht,Das heißt: Die Parteien und Personen,Parteiendemokratie: Die Parteien und ihre Ziele
1199,P_manually,,zwischenbericht,machen Werbung für sich.,Parteien sind ein zentraler Bestandteil des politischen Systems in Deutschland.
1200,P_manually,,zwischenbericht,Und informieren: Das möchten sie für die Menschen machen. Werbung machen heißt hier: Sie hängen Plakate auf.,In Parteien schließen sich Menschen mit gleichen (politischen) Überzeugungen zusammen.
1201,P_manually,,zwischenbericht,"Es gibt Werbung im Internet, Radio, im Fernsehen und in der Zeitung. Es gibt Info-Stände in der Stadt. Es gibt Reden von Politikern und Politikerinnen in verschiedenen Städten. Alle sollen vor der Wahl wissen:","Die Gründung von Parteien ist im Grundgesetz verankert, während das Parteiengesetz die entstandenen Parteien reguliert."
1202,P_manually,,zwischenbericht,Das möchten die Parteien und Politiker machen. Man kann den Politikern auch Fragen stellen. Zum Beispiel:,"Parteien, die genügend Wählerstimmen erhalten, sind als Fraktionen im Parlament vertreten."
1203,P_manually,,zwischenbericht,"Was möchten Sie tun, wenn Sie gewählt werden? Warum sollte ich Ihnen meine Stimme geben? Was möchten Sie für Menschen mit Behinderung tun? Information helfen beim Wählen einer Partei oder einer Person.",Welche Partei soll ich wählen?
1204,P_manually,,zwischenbericht,"Dann können die Wähler entscheiden: Diese Partei und diese Person möchte ich wählen. Wen wähle ich? Erst informieren, dann wählen.","Jede Wählerin und jeder Wähler muss für sich selbst entscheiden, welche Partei sie oder ihn am besten vertreten kann."
1205,P_manually,,zwischenbericht,Die Entscheidung ist schwer. Die Wähler sollen wissen: Was wollen die Parteien oder Personen?,"Man kann sich die Frage stellen: ""Welche Partei stimmt mit meinen eigenen Vorstellungen am ehesten überein?"""
1206,P_manually,,zwischenbericht,Das steht im Wahl-Programm der Partei. Das Wahl-Programm gibt es oft auch in Leichter Sprache. Oft gibt es Info-Stände von Parteien.,"Um diese Frage leichter zu beantworten, gibt es z. B. den sogenannten Wahl-O-Maten der Bundeszentrale für politische Bildung (bpb)."
1207,P_manually,,zwischenbericht,Dort können Bürger und Bürgerinnen Fragen stellen. Und Informationen bekommen. Informationen gibt es auch:,"Man kann sich auch direkt bei den Parteien informieren und Fragen zu bestimmten Themen stellen, wie dem Klimawandel, der Digitalisierung oder der Barrierefreiheit."
1208,P_manually,,zwischenbericht,im Internet im Radio im Fernsehen in der Zeitung.,Viele Antworten ergeben sich bereits aus den Parteiprogrammen der einzelnen Parteien.
1209,P_manually,,zwischenbericht,Eine besondere Hilfe ist der Wahl-O-Mat. Das ist ein Angebot im Internet.,Wichtig: Niemand darf zur Wahl einer bestimmten Partei gedrängt werden.
1210,P_manually,,zwischenbericht,Der Wahl-O-Mat wird immer,Darum finden Wahlen immer geheim statt.
1211,P_manually,,zwischenbericht,einige Wochen vor einer Wahl veröffentlicht.,"Man muss niemandem sagen, wen man gewählt hat."
1212,P_manually,,zwischenbericht,Der Wahl-O-Mat stellt viele Fragen. Dazu gibt es verschiedene Antworten zur Auswahl. Jeder wählt für sich die passende Antwort.,"So hat jede Wählerin und jeder Wähler die Möglichkeit, die Partei zu wählen, die sie oder ihn am besten vertritt."
1213,P_manually,,zwischenbericht,Zum Schluss zeigt der Wahl-O-Mat: Diese Parteien passen gut zu Ihren Antworten. So kann jeder sehen: Welche Partei vertritt am besten meine Meinung?,Parteien in Deutschland im Überblick Auf dieser Seite können Sie sich über die Parteien in Deutschland informieren.
1214,P_manually,,zwischenbericht,"Dann weiß man oft, wen man wählen möchte.",Das ist wichtig für Ihre Wahlentscheidung.
1215,P_manually,,zwischenbericht,Wie wähle ich?,Ein Angebot der Bundeszentrale für politische Bildung (bpb).
1216,P_manually,,zwischenbericht,Jeder Wähler und jede Wählerin bekommt eine Wahl-Benachrichtigung. Das ist ein Brief. Er kommt mit der Post zu Ihnen nach Hause.,Parteiunterlagen (bzw. Parteiprogramme) der einzelnen Parteien Sehr viele Parteien stellen dem Bundeswahlleiter ihr Parteiprogramm zur Verfügung.
1217,P_manually,,zwischenbericht,Darin steht: Wann die Wahl ist. Wo der Wahl-Raum ist. Ob der Raum barriere-frei ist.,Sie können diese Programme mit den Zielen der Parteien hier kostenlos einsehen.
1218,P_manually,,zwischenbericht,Wie die Brief-Wahl geht. Ein anderes Wort für Wahl-Raum ist: Wahl-Lokal. Für die Wahl gibt es 2 Möglichkeiten:,Ein Angebot auf www.bundeswahlleiter.de.
1219,P_manually,,zwischenbericht,Wählen im Wahl-Lokal Ausweis und Benachrichtigung mitnehmen,Informationen in Leichter Sprache zur Wahl
1220,P_manually,,zwischenbericht,Gehen Sie am Wahl-Tag zum Wahl-Lokal. Der Ort steht in der Wahl-Benachrichtigung. Das müssen Sie mit-nehmen: Ihren Personal-Ausweis,"Weitere Informationen zu Wahlen, zum Wahlkampf und zu Wahlmöglichkeiten gibt es auf unserer Wahl-Hilfe-Seite in Leichter Sprache."
1221,P_manually,,zwischenbericht,und Ihre Wahl-Benachrichtigung. Im Wahl-Lokal sind Wahl-Helfer und Wahl-Helferinnen. Denen zeigen Sie:,Besonderheiten bei Wahlen für Menschen mit Behinderung Wahlassistenz ist bei Wahlen erlaubt
1222,P_manually,,zwischenbericht,Ihren Personal-Ausweis und Ihre Wahl-Benachrichtigung. Dann bekommen Sie einen Stimm-Zettel.,"Wahlassistenz, also die Unterstützung beim Wahlvorgang selbst, ist erlaubt."
1223,P_manually,,zwischenbericht,Auf dem Stimm-Zettel sind alle Parteien und Personen. Die können Sie dann wählen.,Allerdings darf jeder Wahlberechtigte sein Wahlrecht nur einmal und nur persönlich ausüben.
1224,P_manually,,zwischenbericht,In der Wahl-Kabine wählt man mit dem Stimm-Zettel Die Wahl ist geheim.,Wahlfälschung ist bei Wahlen verboten
1225,P_manually,,zwischenbericht,"Das heißt: Niemand soll sehen, wen Sie wählen. Sie müssen das auch niemandem sagen.",Eine Ausübung des Wahlrechts durch einen Vertreter oder eine Vertreterin anstelle des Wahlberechtigten ist unzulässig.
1226,P_manually,,zwischenbericht,Deshalb wählen Sie in einer Wahl-Kabine. Das ist ein Tisch mit Wänden rundherum. Dort machen Sie Ihre Kreuze auf dem Stimm-Zettel.,"Wenn die Entscheidung, wo das Kreuz gesetzt wird, nicht vom Wahlberechtigten ausgeht oder sie durch eine missbräuchliche Einflussnahme erfolgte, handelt es sich um Wahlfälschung."
1227,P_manually,,zwischenbericht,Sie dürfen nur eine bestimmte Anzahl Kreuze machen.,Wahlfälschung ist strafbar.
