,Source,link_leicht,URL,sents_leicht,sents_standard
1739,P_manually,,zwischenbericht,in jedem Bundes-Land.,Was ist eine Anhörung?
1740,P_manually,,zwischenbericht,Sie haben verschiedene Aufgaben.,Im Betreuungsverfahren ist die Anhörung der rechtlich zu betreuenden Person sehr wichtig: Entscheidungen dürfen nicht über den Kopf des Menschen mit Behinderung hinweg getroffen werden. Zudem können sich Betreuungsrichter*innen nur im persönlichen Gespräch eine Vorstellung von der Persönlichkeit des zu betreuenden Menschen machen.
1741,P_manually,,zwischenbericht,"Sie helfen zum Beispiel dem Gericht, einen guten Betreuer zu finden.","Wenn möglich, sollte die Anhörung in der gewohnten Umgebung des zu betreuenden Menschen stattfinden, also etwa bei ihm zuhause."
1742,P_manually,,zwischenbericht,Sie können Betreuer auch beraten und unterstützen.,"Die Anhörung gibt der betroffenen Person auch die Möglichkeit, sich zu dem Sachverständigengutachten zu äußern."
1743,P_manually,,zwischenbericht,Was ist ein Betreuungs-Verein?,Deshalb muss das Betreuungsgericht das Sachverständigengutachten dem zu betreuenden Menschen grundsätzlich vor der Anhörung vollständig übermitteln.
1744,P_manually,,zwischenbericht,In einem Betreuungs-Verein arbeiten Betreuer und andere Fach-Leute zusammen. Die Mitarbeiter vom Verein können auch Betreuungen führen.,"Neben dem betroffenen Menschen ist auch die Betreuungsbehörde zwingend anzuhören. Angehörige und Vertrauenspersonen sind dann anzuhören, wenn sie am Verfahren beteiligt worden sind."
1745,P_manually,,zwischenbericht,Der Verein hat auch andere Aufgaben: Zum Beispiel:,"Ist dies nicht der Fall, besteht keine Pflicht zur Anhörung von Eltern, Geschwistern oder anderen Verwandten."
1746,P_manually,,zwischenbericht,Er hilft anderen Betreuern bei ihrer Arbeit.,"Jedoch wird das Gericht in den meisten Fällen auch die Angehörigen dazu befragen, wie sie zur Einrichtung einer rechtlichen Betreuung stehen. Die gerichtliche Entscheidung Nach der Anhörung und dem Erhalt der Informationen aus dem Sozialbericht sowie dem Sachverständigengutachten trifft das Betreuungsgericht eine Entscheidung. Erachtet das Gericht eine rechtliche Betreuung als notwendig, muss es in der Entscheidung regeln, wer rechtliche Betreuer*in werden soll und mit welchem Aufgabenkreis."
1747,P_manually,,zwischenbericht,Wer kann rechtlicher Betreuer werden? Verschiedene Menschen können eine rechtliche Betreuung übernehmen.,"Über rechtliche Betreuerinnen und Betreuer Wenn das Betreuungsgericht eine rechtliche Betreuung als notwendig erachtet, entscheidet es in der Regel, wer rechtlicher Betreuer*in des betroffenen Menschen wird. Wer kann rechtliche Betreuer*in werden?"
1748,P_manually,,zwischenbericht,Es gibt ehrenamtliche Betreuer und Berufs-Betreuer.,"Rechtliche Betreuer*innen können ehrenamtliche Betreuer*innen, Berufs- oder Vereinsbetreuer*innen, aber auch ein Betreuungsverein sein. Auswahl der Betreuer*innen"
1749,P_manually,,zwischenbericht,Mehr über die Unterschiede lesen Sie hier.,"Die rechtlich zu betreuende Person soll bei der Auswahl ihrer rechtlichen Betreuer*in mitbestimmen. Daher hat sie ein Vorschlagsrecht, wer ihre rechtliche Betreuer*in werden soll. Die rechtlich zu betreuende Person kann dem Betreuungsgericht mitteilen, wen sie sich als rechtliche Betreuer*in wünscht; aber auch, welche Person sie sich nicht wünscht. Für das Vorschlagsrecht ist keine Geschäfts- oder Einsichtsfähigkeit der rechtlich zu betreuenden Person erforderlich."
1750,P_manually,,zwischenbericht,Ehrenamtliche Betreuer Zum Beispiel: Ehrenamtliche Betreuer.,"Die rechtlich zu betreuende Person soll ihre potenzielle Betreuer*in kennenlernen, bevor sie ihre Betreuer*in wird."
1751,P_manually,,zwischenbericht,Ehrenamtlich heißt: Sie bekommen für ihre Arbeit keinen Lohn.,"Wichtig: Eine Person, die zu einem Träger von Einrichtungen oder Diensten, der in der Versorgung des rechtlich zu betreuenden Menschen tätig ist, in einem Abhängigkeitsverhältnis steht, darf nicht zur rechtlichen Betreuer*in bestellt werden."
1752,P_manually,,zwischenbericht,Oft sind Angehörige ehrenamtliche Betreuer.,"Das gilt auch für Personen, die in der ambulanten Versorgung des rechtlich zu betreuenden Menschen beschäftigt sind. Hier besteht die Gefahr, dass die Person in einem Interessenskonflikt steht."
1753,P_manually,,zwischenbericht,Zum Beispiel: Der Vater oder die Mutter. Die Schwester oder der Bruder. Man sagt auch:,"Eine Ausnahme von diesem Bestellhindernis liegt dann vor, wenn die Gefahr der Interessenskollision nachweislich nicht gegeben ist."
1754,P_manually,,zwischenbericht,Ehrenamtliche Angehörigen-Betreuer.,Ehrenamtliche Betreuer*innen Im Betreuungsrecht gilt der Grundsatz der Ehrenamtlichkeit.
1755,P_manually,,zwischenbericht,Manche ehrenamtlichen Betreuer sind nicht mit der rechtlich betreuten Person verwandt oder befreundet.,"Das bedeutet, dass die rechtliche Betreuung in erster Linie von ehrenamtlichen Betreuer*innen geführt werden soll."
1756,P_manually,,zwischenbericht,Man sagt auch: Ehrenamtliche Fremd-Betreuer. Unterstützung für ehrenamtliche Betreuer Betreuungs-Vereine machen eine wichtige Arbeit.,Das Betreuungsrecht unterscheidet bei den ehrenamtliche Betreuer*innen zwischen sog. ehrenamtlichen Angehörigenbetreuer*innen und ehrenamtlichen Fremdbetreuer*innen.
1757,P_manually,,zwischenbericht,Sie unterstützen zum Beispiel ehrenamtliche Betreuer. Ehrenamtliche Betreuer sollen ihre Arbeit gut machen.,"Ehrenamtliche Angehörigenbetreuer*innen sind diejenigen, die eine familiäre Beziehung oder eine persönliche Bindung zur rechtlich betreuten Person haben."
1758,P_manually,,zwischenbericht,Deshalb sollen sie mehr Hilfe von einem Betreuungs-Verein bekommen. Der Betreuungs-Verein kann sie beraten und unterstützen.,"Ehrenamtliche Fremdbetreuer*innen sind diejenigen, die keine solche Beziehung oder Bindung zur rechtlich betreuten Person haben."
1759,P_manually,,zwischenbericht,Darum sollen ehrenamtliche Betreuer einen Vertrag mit einem Betreuungs-Verein machen. In dem Vertrag steht:,"Ehrenamtliche Fremdbetreuer*innen sollen nur bestellt werden, wenn sie vor ihrer Bestellung zur rechtlichen Betreuer*in eine Anbindungserklärung zu einem Betreuungsverein abgeben haben."
1760,P_manually,,zwischenbericht,"So ist die Hilfe geregelt. Der ehrenamtliche Betreuer soll auch an Schulungen teilnehmen. Darum kann es in den Schulungen gehen: Betreuungs-Recht, Sozial-Recht oder um die Unterstützung vom Betreuten.","Darin steht z. B., dass der Betreuungsverein sie bei Fragen zur Betreuung berät und sie sich regelmäßig fortbilden sollen, damit sie über Neuerungen im Betreuungs- oder Sozialrecht informiert sind."
1761,P_manually,,zwischenbericht,Angehörigen-Betreuer müssen so einen Vertrag nicht machen. Aber sie können so einen Vertrag machen. Berufs-Betreuer,"Ehrenamtliche Angehörigenbetreuer*innen können eine solche Erklärung abgegeben. Da dies eine sinnvolle Unterstützung ihrer Arbeit ist, sollten daher auch sie von dieser Möglichkeit Gebrauch machen."
1762,P_manually,,zwischenbericht,Es gibt auch Berufs-Betreuer. Das sind oft Sozial-Arbeiter oder Juristen. Menschen rechtlich zu betreuen ist ihre Arbeit. Sie bekommen dafür Lohn.,"Stehen Eltern, Geschwister, Verwandte, Nachbarn oder enge Vertraute des rechtlich zu betreuenden Menschen zur Verfügung, dann soll eine Betreuung vorrangig ehrenamtlich durch diese Personen erfolgen."
1763,P_manually,,zwischenbericht,Manche Berufs-Betreuer sind selbständig. Andere arbeiten in einem Betreuungs-Verein. Damit Berufs-Betreuer,"Schlägt die rechtlich zu betreuende Person niemanden vor, berücksichtigt das Gericht bei der Auswahl der rechtlichen Betreuer*in die verwandtschaftlichen und sonstigen Bindungen der zu betreuenden Person."
1764,P_manually,,zwischenbericht,"als Betreuer arbeiten können, müssen sie bei der Bereuungs-Behörde angemeldet sein. Dazu sagt man auch: Registrierung. Bei der Anmeldung müssen sie zeigen:",Das Betreuungsgericht kann mehrere ehrenamtliche Betreuer*innen gleichzeitig bestellen.
1765,P_manually,,zwischenbericht,Sie kennen sich mit Betreuungen gut aus. Und sind für die Arbeit als Betreuer geeignet. Wie wird ein rechtlicher Betreuer ausgewählt? Betreute können bei der Auswahl,So können z. B. beide Elternteile eines jungen Menschen mit Behinderung seine rechtlichen Betreuer*innen werden.
1766,P_manually,,zwischenbericht,vom Betreuer mit-bestimmen. Sie können sagen: Wer ihr Betreuer sein soll. Das Betreuungs-Gericht muss diesen Wunsch beachten. Betreute können dem Gericht auch sagen:,"Möglich ist es auch, dass rechtliche Betreuer*innen für unterschiedliche Aufgabenbereiche zuständig sind."
1767,P_manually,,zwischenbericht,Wer nicht rechtlicher Betreuer sein soll. Das Gericht muss sich auch daran halten. Außerdem soll der Betreute den Betreuer kennenlernen.,Berufsbetreuer*innen
1768,P_manually,,zwischenbericht,Und zwar bevor das Betreuungs-Gericht den Betreuer bestellt. Erst danach soll das Gericht entscheiden.,"Eine Berufsbetreuer*in darf nur dann bestellt werden, wenn sie als Berufsbetreuer*in registriert ist."
1769,P_manually,,zwischenbericht,Manchmal muss sich das Gericht aber auch nicht an den Wunsch halten. Zum Beispiel: Wenn die gewünschte Person die Betreuung nicht übernehmen kann oder will. Das können zum Beispiel die Gründe sein:,"Mit der Registrierung müssen sie u. a. nachweisen, dass sie z. B. Kenntnisse im Betreuungsrecht und Sozialrecht haben oder wissen, wie mit Personen mit Erkrankungen und Behinderungen kommuniziert werden kann."
1770,P_manually,,zwischenbericht,"Die gewünschte Person kennt sich nicht im Betreuungs-Recht aus. Sie hat keine Zeit für die Betreuung. Oder sie arbeitet in der Einrichtung, in der der Betreute lebt. Oder sie ist ein Berufs-Betreuer ist.","Wie die Registrierung erfolgt und welche Kenntnisse die Berufsbetreuer*in hierfür konkret nachweisen muss, ist in der Betreuerregistrierungsverordnung geregelt."
1771,P_manually,,zwischenbericht,"Denn ein Berufs-Betreuer darf nur rechtlich betreuen, wenn es keinen ehrenamtlichen Betreuer gibt. Was sind die wichtigsten Aufgaben vom Betreuer? Das Betreuungs-Gericht bestimmt:",Eine Berufsbetreuer*in übernimmt geschäftsmäßig Betreuungen.
1772,P_manually,,zwischenbericht,"Bei welchen Dingen der Betreuer dem Betreuen hilft. Deswegen müssen Betreute dem Gericht sagen, wo sie Hilfe brauchen.",Sie soll nur im Ausnahmefall bestellt werden; selbst wenn die rechtlich zu betreuende Person sich ausdrücklich eine Berufsbetreuer*in wünscht.
1773,P_manually,,zwischenbericht,"Zum Beispiel: beim Umgang mit Geld, beim Thema Gesundheit, beim Schreiben von Briefen,","Ein Ausnahmefall liegt z.B. vor, wenn eine ehrenamtliche Betreuung nicht möglich ist, weil der rechtlich zu betreuende Mensch keine nahen Angehörigen hat."
1774,P_manually,,zwischenbericht,bei der Wohnungs-Suche oder beim Kontakt mit Behörden. In den folgenden Texten lesen Sie: Was die wichtigsten Aufgaben von einem Betreuer sind.,Oder wenn die Angehörigen zu einer rechtlichen Betreuung nicht in der Lage sind und auch keine andere Vertrauensperson des behinderten Menschen zur Verfügung steht.
1775,P_manually,,zwischenbericht,Der Betreuer unterstützt den Betreuten Der Betreute soll selbst bestimmen können. Der Betreuer soll ihn dabei unterstützen. Die wichtigste Aufgabe,"Eine Berufsbetreuer*in wird außerdem dann bestellt, wenn die Anforderungen an die rechtliche Betreuung so hoch sind, dass eine Berufsbetreuer*in fachlich besser geeignet ist."
1776,P_manually,,zwischenbericht,vom Betreuer ist deshalb: Der Betreuer unterstützt den Betreuten bei wichtigen Entscheidungen. Zum Beispiel:,"Unter bestimmten Voraussetzungen kann das Gericht auch mehrere Berufsbetreuer*innen gleichzeitig bestellen, z.B. für den Fall, dass eine der Betreuer*innen verhindert ist."
1777,P_manually,,zwischenbericht,"Er erklärt einen Vertrag in Leichter Sprache. Oder die Folgen von einer Operation. Das hilft dem Betreuten. Denn dann kann er selbst entscheiden,",Welche Rechte und Pflichten haben rechtliche Betreuer*innen?
1778,P_manually,,zwischenbericht,ob er einen Vertrag machen will. Oder ob er operiert werden will. Darum muss der Betreuer wissen: Was der Betreute will.,Eine rechtliche Betreuer*in hat die Angelegenheiten des rechtlichen betreuten Menschen in den ihr übertragenen Aufgabenkreisen unter Beachtung aller gesetzlichen Bestimmungen zu führen.
1779,P_manually,,zwischenbericht,Deshalb muss der Betreuer nach den Wünschen vom Betreuten fragen. Der Betreuer muss sich an die Wünsche vom Betreuten halten Betreute sollen selbst über ihr Leben bestimmen. Dazu sagt man auch: Selbst-Bestimmung.,"Wichtigste Aufgabe der rechtlichen Betreuer*in ist es, den rechtlich betreuten Menschen zu unterstützen, damit er selbst eine Entscheidung treffen und diese umsetzen kann."
1780,P_manually,,zwischenbericht,Das gilt für große Entscheidungen. Zum Beispiel: Wo will ich wohnen? Lasse ich mich operieren?,Die rechtliche Betreuer*in:
1781,P_manually,,zwischenbericht,Schreibe ich ein Testament? Wo will ich arbeiten? Und das gilt für kleinere Entscheidungen. Zum Beispiel:,"hat das Selbstbestimmungsrecht der rechtlich betreuten Person zu achten,"
1782,P_manually,,zwischenbericht,Was möchte ich essen? Wann gehe ich ins Bett? Was möchte ich anziehen? Hier darf der Betreuer nicht reinreden.,"muss die Wünsche der rechtlich betreuten Person feststellen, ist an diese grundsätzlich gebunden und muss die rechtlich betreute Person bei der Umsetzung dieser wünsche unterstützen,"
1783,P_manually,,zwischenbericht,Er darf auch nicht seine Meinung aufdrängen. Denn Betreute kennen ihr Leben besser als der Betreuer. Deshalb stehen die Wünsche vom Betreuten an erster Stelle. Deswegen muss der Betreuer nach den Wünschen vom Betreuten fragen.,"darf nur dann stellvertretend tätig sein, wenn dies zwingend notwendig ist (Unterstützen vor Vertreten!),"
1784,P_manually,,zwischenbericht,"Denn er muss wissen: Was will der Betreute? Der Betreuer soll sich immer an die Wünsche vom Betreuten halten. Der Betreuer darf also nicht einfach für den Betreuten entscheiden. Oder Sachen machen,","muss alle Angelegenheiten innerhalb des angeordneten Aufgabekreises mit der rechtlich betreuten Person besprechen,"
1785,P_manually,,zwischenbericht,mit denen der Betreute nicht einverstanden ist. Aber es gibt Ausnahmen. Zum Beispiel: Die Wünsche vom Betreuten sind für ihn gefährlich.,"muss den erforderlichen Kontakt zur rechtlich betreuten Person halten und sich regelmäßig einen persönlichen Eindruck von ihr verschaffen,"
1786,P_manually,,zwischenbericht,Weil die Wünsche das Leben vom Betreuten gefährden. Oder das Vermögen vom Betreuten gefährden. Ein Vermögen ist zum Beispiel gespartes Geld. Oder der Betreute kann nicht mehr selbst entscheiden.,muss ihre Rehabilitation unterstützen und
1787,P_manually,,zwischenbericht,"Dann darf der Betreuer ausnahmsweise für den Betreuten entscheiden. Die Entscheidung kann auch gegen die Wünsche vom Betreuten sein. Der Betreuer muss dem Gericht sagen, wenn und warum er sich nicht an die Wünsche vom Betreuten hält.",mit dem Betreuungsgericht zusammenarbeiten.
1788,P_manually,,zwischenbericht,Der Betreuer vertritt den Betreuten Der Betreuer darf den Betreuten auch vertreten. Das bedeutet: Der Betreuer darf für den Betreuten Verträge schließen.,"Im Hinblick auf die Zusammenarbeit mit dem Betreuungsgericht ist die rechtliche Betreuer*in verpflichtet, diesem auf Verlangen jederzeit über die Führung der rechtlichen Betreuung und die persönlichen Verhältnisse des rechtlich betreuten Menschen Auskunft zu erteilen."
1789,P_manually,,zwischenbericht,"Zum Beispiel: einen Miet-Vertrag. Der Betreuer soll den Betreuten aber nur vertreten, wenn es nicht anders geht.",Die rechtliche Betreuer*in muss dem Gericht zudem regelmäßig über die rechtlich betreute Person berichten.
1790,P_manually,,zwischenbericht,Zum Beispiel: Weil der Betreute nicht mehr selbst entscheiden kann. Oder weil das zum Schutz vom Betreuten nötig ist. Der Betreuer und der Betreute müssen oft Kontakt haben.,Über die Berichtspflichten
1791,P_manually,,zwischenbericht,Und der Betreuer soll den Betreuer regelmäßig sehen. Der Betreuer muss alles mit dem Betreuten besprechen. Wie arbeitet der rechtliche Betreuer mit dem Betreuungs-Gericht zusammen? Das Betreuungs-Gericht kontrolliert den rechtlichen Betreuer.,Anfangsbericht
1792,P_manually,,zwischenbericht,Das bedeutet:,Zunächst gibt es den sogenannten Anfangsbericht.
1793,P_manually,,zwischenbericht,"Das Betreuungs-Gericht passt auf, ob der Betreuer seine Arbeit gut macht. Dafür schreibt der Betreuer Berichte. Ein Bericht ist ein Text.",Mit der Übernahme der Betreuung muss die rechtliche Betreuer*in einen Bericht über die persönlichen Verhältnisse der rechtlich betreuten Person erstellen.
1794,P_manually,,zwischenbericht,Den Text schreibt der Betreuer für das Betreuungs-Gericht.,Dieser bezieht sich auf die persönliche Situation der rechtlich betreuten Person.
1795,P_manually,,zwischenbericht,"In den folgenden Texten lesen Sie: Welche Berichte es gibt. Warum der Betreuer aufschreiben muss,","Hierzu gehören ihre Lebens-, Wohn- und Arbeitssituation, ihre sozialen sowie wirtschaftlichen Verhältnisse, ihre Fähigkeiten und Ressourcen, mögliche Beeinträchtigungen und Schwierigkeiten, ihr Sozialverhalten und ihre familiären und sozialen Kontakte."
1796,P_manually,,zwischenbericht,wie viel Geld der Betreute hat. Was das Gericht genehmigen muss. Bericht zum Anfang der Betreuung Bericht am Jahres-Ende,Weitere Inhalte des Anfangsberichts sind die sich aus den Wünschen und Vorstellungen der rechtlich betreuten Person ergebenden realistischen Ziele im Rahmen der rechtlichen Betreuung.
1797,P_manually,,zwischenbericht,Der Betreuer schreibt einen Bericht. Das macht er 1 mal im Jahr.,"Da die Wünsche der rechtlich betreuten Person Handlungsmaßstab für die rechtliche Betreuer*in sind, sind auch diese im Anfangsbericht festzuhalten. Der Anfangsbericht soll dem Betreuungsgericht innerhalb von drei Monaten nach der Bestellung übersandt werden."
1798,P_manually,,zwischenbericht,Zu so einem Bericht sagt man auch:,Darüber hinaus kann das Gericht den Bericht mit der rechtlich betreuten Person und der rechtlichen Betreuer*in besprechen.
1799,P_manually,,zwischenbericht,Jahres-Bericht.,"Ehrenamtliche Angehörigenbetreuer*innen sind nicht verpflichtet, einen Anfangsbericht anzufertigen. Sie können es aber."
1800,P_manually,,zwischenbericht,Der Jahres-Bericht ist für das Betreuungs-Gericht.,"Anstelle des Anfangsberichts führt das Gericht mit der rechtlich betreuten Person auf deren Wunsch und in anderen geeigneten Fällen ein Anfangsgespräch. Ziel des Gesprächs ist es, Informationen über die persönlichen Verhältnisse, den Regelungsbedarf und die Wünsche der rechtlich betreuten Person zu erhalten. Es gehört zu den essentiellen Aufgaben der rechtlichen Betreuer*in, sich am Anfang einer Betreuung, aber auch in deren Verlauf, zu überlegen, welche Ziele die rechtliche Betreuung haben soll, welche Maßnahmen zu ergreifen sind und wie der Rehabilitationsauftrag erfüllt werden kann."
1801,P_manually,,zwischenbericht,In dem Bericht steht:,Der Anfangsbericht ist hierfür ein gutes Instrument.
1802,P_manually,,zwischenbericht,Wie läuft die Betreuung? Wie oft haben der Betreute und der Betreuer miteinander geredet? Worüber haben sie geredet?,"Daher sollten ehrenamtliche Angehörigenbetreuer*innen von der Möglichkeit, einen Anfangsbericht anzufertigen, Gebrauch machen. In jedem Fall sollte zumindest die Möglichkeit des Anfangsgesprächs genutzt werden."
1803,P_manually,,zwischenbericht,Wie oft haben sich der Betreute und der Betreuer gesehen? Was hat der Betreuer gemacht?,Jahresbericht Weiterhin ist die rechtliche Betreuer*in zu jährlichen Berichten über die rechtlich betreute Person verpflichtet (sogenannter Jahresbericht).
1804,P_manually,,zwischenbericht,"Wann hat der Betreuer anders gehandelt, als es der Betreute wollte?","Darin muss die rechtliche Betreuer*in u.a. Angaben über Art, Umfang und Anlass ihrer persönlichen Kontakte zur rechtlich betreuten Person und über ihren persönlichen Eindruck machen."
1805,P_manually,,zwischenbericht,Soll die Betreuung weiter-gehen?,Die rechtliche Betreuer*innen muss auch über ihre konkreten Tätigkeiten berichten.
1806,P_manually,,zwischenbericht,Welche Ziele wurden mit der Betreuung erreicht?,"Das bedeutet, sie muss erläutern, welche Betreuungsziele umgesetzt und welche Maßnahmen durchgeführt wurden."
1807,P_manually,,zwischenbericht,Kann die Betreuung von einem ehrenamtlichen Betreuer übernommen werden? Wie findet der Betreute die Betreuung?,Ein wesentlicher Aspekt des Jahresberichts ist die Sichtweise der rechtlich betreuten Person zu den genannten Punkten.
1808,P_manually,,zwischenbericht,Den Bericht soll der Betreuer mit den Betreuten besprechen. Betreute sollten den Betreuer deswegen jedes Jahr nach dem Bericht fragen. Sie sollten sagen:,Auch diese muss die rechtliche Betreuer*in mitteilen. Überdies hat die rechtliche Betreuer*in den Jahresbericht mit der rechtlich betreuten Person in einer für sie verständlichen Weise zu besprechen.
1809,P_manually,,zwischenbericht,Ich will den Bericht mit dem Betreuer besprechen.,"Das Gespräch über den Jahresbericht stellt sicher, dass die rechtlich betreute Person in die gerichtliche Kontrolle einbezogen wird."
1810,P_manually,,zwischenbericht,"Damit sie wissen,","Schlussbericht Nach der Beendigung der rechtlichen Betreuung hat die rechtliche Betreuer*in einen sogenannten Schlussbericht zu erstellen. Hierbei ist es unerheblich, ob die Betreuung durch Tod des rechtlich betreuten Menschen, durch einen Betreuer*innenwechsel oder durch Aufhebung endet."
1811,P_manually,,zwischenbericht,was in dem Bericht über sie steht.,"Im Schlussbericht muss die rechtliche Betreuer*in u.a. angeben, welche Gegenstände sie an wen ausgehändigt hat."
1812,P_manually,,zwischenbericht,"Übersicht über das Vermögen vom Betreuten Manchmal hat der Betreuer die Aufgabe, den Betreuten bei Geld-Dingen zu helfen.","War die rechtliche Betreuer*in z.B. für die Vermögenssorge zuständig, muss sie bei Beendigung der rechtlichen Betreuung das von ihr verwaltete Vermögen der rechtlich betreuten Person und sämtliche dazugehörige Unterlagen an die rechtlich betreute Person, ihre Erb*innen oder sonstige Berechtigte (z.B. Nachlassverwalter*in, die neue rechtliche Betreuer*in) herausgeben."
1813,P_manually,,zwischenbericht,Dazu sagt man auch:,Weitere Berichtspflichten
1814,P_manually,,zwischenbericht,"Vermögens-Sorge. Hat der Betreuer die Vermögens-Sorge, muss der Betreuer zum Beginn der Betreuung eine Übersicht erstellen.","Sind der rechtlichen Betreuer*in auch Aufgaben der Vermögenssorge übertragen, muss sie zu Beginn der rechtlichen Betreuung ein Vermögensverzeichnis anlegen und jährlich Rechenschaft ablegen."
1815,P_manually,,zwischenbericht,In der Übersicht steht: Wie viel Geld hat der Betreute? Wie viel Geld bekommt der Betreute? Wie viel Geld gibt der Betreute aus.,"Sind die Eltern, Großeltern, Kinder, die Ehegatt*in oder Geschwister zur rechtlichen Betreuer*in bestellt, sind sie in der Regel als sogenannte befreite Betreuer*in von der Rechnungslegungspflicht entbunden."
1816,P_manually,,zwischenbericht,Dazu sagt man auch: Vermögens-Verzeichnis. Außerdem muss der Betreuer dem Betreuungs-Gericht jedes Jahr sagen:,"Anstelle der jährlichen Rechnungslegung müssen sie dem Betreuungsgericht eine Übersicht über den Bestand des Vermögens, eine sogenannte Vermögensübersicht, vorlegen. Das Gericht kann auch festlegen, dass die Vermögensübersicht spätestens alle fünf Jahre einzureichen ist."
1817,P_manually,,zwischenbericht,Wie viel Geld hat der Betreute in diesem Jahr bekommen? Wie viel Geld hat der Betreute in diesem Jahr ausgegeben? Wofür wurde das Geld ausgegeben? Dazu sagt man auch: Rechnungs-Legung.,Können Betreuer*innen zum Schadensersatz verpflichtet sein?
1818,P_manually,,zwischenbericht,"Wenn ein Angehöriger der Betreuer ist, muss er nicht jedes Jahr eine Rechnung legen.","Entsteht dem rechtlich betreuten Menschen durch das Handeln der rechtlichen Betreuer*in ein Schaden, kommt eine Haftung der Betreuer*in auf Schadensersatz gegenüber der rechtlich betreuten Person in Betracht."
1819,P_manually,,zwischenbericht,Er muss dem Betreuungs-Gericht aber alle 3 bis 5 Jahre sagen: Wie viel Geld hat der Betreute? Dazu sagt man auch:,"Voraussetzung ist, dass die rechtliche Betreuer*in ihre Betreuer*innenpflichten vorsätzlich oder fahrlässig verletzt hat und der entstandene Schaden auf dieser Verletzung beruht."
1820,P_manually,,zwischenbericht,Eine Vermögens-Übersicht vorlegen. Genehmigung vom Betreuungs-Gericht,Für ehrenamtliche Betreuer*innen sind in fast allen Bundesländern Sammel-Haftpflicht-Versicherungen eingerichtet. Dies gilt zumindest für Vermögensschäden.
1821,P_manually,,zwischenbericht,"Will der Betreuer manche Dinge tun,",In einigen Bundesländern sind über die Sammel-Haftpflicht-Versicherung auch Sach- und Personenschäden abgedeckt.
1822,P_manually,,zwischenbericht,muss er das Gericht um Erlaubnis fragen.,Für den Versicherungsschutz bedarf es zum Teil keiner gesonderten Anmeldung.
1823,P_manually,,zwischenbericht,Dazu sag man auch: Eine Genehmigung einholen. Dann braucht der Betreuer zum Beispiel die Erlaubnis vom Gericht:,"Stattdessen besteht für ehrenamtliche Betreuer*innen ab der Bestellung zur rechtlichen Betreuer*in automatisch Versicherungsschutz. Hinweis: Eine Übersicht darüber, welche Bundesländer Versicherungen für ehrenamtliche Betreuer*innen abgeschlossen haben und welche Haftungsvoraussetzungen und Haftungsumfänge sich aus diesen ergeben, findet sich in der Antwort der Bundesregierung vom 15. August 2019 (Drucksachennummer 19/12404, S. 6 f.)."
