,Unnamed: 0,website,title_leicht,text_leicht,title_normal,text_normal,source,token_leicht,token_normal,sents_leicht,sents_normal,text_leicht_sents,text_normal_sents
0,0,www.gww-netz.de,Angebote + Tätigkeiten,"Das Ziel der GWW ist:
Alle Menschen sollen gemeinsam leben und arbeiten können.
Bei der GWW gibt es angepasste Arbeitsplätze 
für Menschen mit Behinderung 
und Menschen mit einer psychischen Erkrankung. 
Die Job-Coaches unterstützen Sie 
auf Ihrem Weg auf den Arbeitsmarkt.
Arbeitsangebote

Bei der GWW gibt es viele Arbeits-Angebote.
Sie können

mit Menschen arbeiten
im Büro arbeiten
in der Produktion und Montage arbeiten
mit Holz arbeiten
mit Metall arbeiten
im Freien arbeiten
in der Logistik arbeiten
mit Tieren arbeiten.... und viele andere Tätigkeiten kann man bei der GWW machen.
Zusätzliche Tätigkeiten

Sie möchten mehr tun, als Ihre tägliche Arbeit bei der GWW?
Dann gibt es interessante zusätzliche Tätigkeiten:

Regal-Prüfer
Aufzugs-Wärter
Werkstatt-Rat
Brandschutz-Helfer
Sicherheits-Beauftragter
Kultur-Vermittler
Campus Mensch Redaktion
Werkstatt-Entgelt

Die GWW bezahlt Ihnen mehr Geld 
als viele andere Werkstätten.

Die Beträge für:

die gesetzliche Kranken-Versicherung
die Pflege-Versicherung
die Renten-Versicherung
werden ebenfalls bezahlt.
Persönliche Bildung

Die GWW hilft Ihnen dabei, 
Ihre Fähigkeiten weiter zu entwickeln.
Dafür gibt es viele Angebote.
Diese Angebote sollen Ihnen helfen, 
Ihren Alltag selbstbewusst zu meistern.
Zum Beispiel, indem Sie Lesen, Schreiben und Rechnen lernen.
Fortbildung und Weiterbildung

Sie möchten sich beruflich weiter entwickeln?
Die GWW bietet viele Fortbildungen und Weiterbildungen an.
Qualifizierungen

Sie können bei der GWW 
Teil-Qualifizierungen in verschiedenen Berufs-Bereichen machen.
Das sind Teile einer anerkannten Berufs-Ausbildung.

Job-Coaching

Die Job-Coaches unterstützen Sie 
bei der Suche nach einem Arbeitsplatz.
Durch verschiedene Praktika 
können Sie ausprobieren, 
welche Arbeit Ihnen Spaß macht und zu Ihnen passt.

Werkstatt Transfer

Das Angebot Werkstatt Transfer hilft Menschen,
die bei der Arbeit in der Werkstatt
mehr Hilfe brauchen.
Campus Mensch

Wir helfen Ihnen
bei der Suche nach einem Arbeitsplatz
auf dem allgemeinen Arbeitsmarkt.
Wir begleiten Sie
bei Ihren Praktika vor Ort.
Mit unserer Hilfe lernen Sie am Arbeitsplatz die Arbeiten,
die Sie an dem Arbeitsplatz können müssen.",Angebote + Tätigkeiten,"Sie leisten sinnvolle Arbeit, entwickeln soziale Kontakte und Kompetenzen. Dabei achten wir immer darauf, Ihren Wünschen an einen Arbeitsplatz, Ihren Fähigkeiten und Neigungen zu entsprechen. Bei uns finden Sie angepasste Arbeitsplätze und Vorrichtungen und erhalten Ihre nötige persönliche Unterstützung und Hilfe. Die GWW hilft Ihnen gesellschaftliche Teilhabe und individuelle Selbstbestimmung zu realisieren. Wir bieten Ihnen umfassende Qualifizierungs- und Bildungsangebote. Unsere Jobcoaches unterstützen Sie auf Ihrem Weg auf den Arbeitsmarkt. Alle Menschen sollen gemeinsam leben und arbeiten können: Das ist unsere Vision.
Arbeitsangebote

Wir bieten Ihnen eine breite Palette an Tätigkeiten. Bei uns können Sie Ihre Fähigkeiten ausschöpfen und erhalten Anerkennung für Ihre Leistung. 
Sie haben die Wahl:

mit Menschen zu arbeiten
im Büro zu arbeiten
in der Produktion und Montage zu arbeiten
mit Holz zu arbeiten
mit Metall zu arbeiten
im Freien zu arbeiten
in der Logistik zu arbeiten.
Weitere individuelle Lösungen sind möglich, wie z.B. Tätigkeiten mit Tieren...
Zusatztätigkeiten

Wenn Sie sich über Ihre tägliche Arbeit in der GWW hinaus engagieren möchten, bieten wir Ihnen eine Vielzahl interessanter Zusatztätigkeiten:

Regalprüfer
Aufzugswärter
Werkstattrat
Brandschutz-Helfer
Sicherheitsbeauftragter
Kulturvermittler
Campus Mensch Redaktion

Werkstattentgelt

Nach § 219 Sozialgesetzbuch Neuntes Buch (SGB IX) bezahlen wir den Menschen mit Behinderung ein ihrer Leistung angemessenes Arbeitsentgelt und liegen hierbei weit über dem Bundesdurchschnitt.

Für Ihre Tätigkeit im Reha-Arbeitsbereich der Werkstatt erhalten Sie ein Entgelt auf Basis der mit dem Gesamtwerkstattrat vereinbarten Entgeltvereinbarung. Dieses teilt sich auf in gesetzlich vorgeschriebenes Grundentgelt plus eine Leistungszulage. Sie sind darüber hinaus in der gesetzlichen Krankenversicherung, Pflegeversicherung und Rentenversicherung versichert. Es fallen für Sie keine Beiträge an; diese werden komplett übernommen.

Persönliche Bildung

Sie möchten selbstbewusst Ihren Alltag gestalten? Die GWW unterstützt Sie dabei, Ihre Fähigkeiten weiterzuentwickeln und durch ständiges Anwenden zu erhalten. Lesen, Schreiben und Rechnen sind Kenntnisse, die über die Arbeit hinaus im Alltag benötigt werden. Sie können weitere Angebote wählen, die Ihnen helfen, Ihren Alltag zu meistern.
 
Fort- und Weiterbildung

Sie möchten sich beruflich weiterentwickeln? Sie möchten in einem neuen Tätigkeitsfeld arbeiten? Sie möchten neue Aufgaben übernehmen? Wir bieten Ihnen zur Qualifizierung oder beruflichen Weiterentwicklung ein großes Fort- und Weiterbildungsangebot.
 Qualifizierungen

Qualifizieren Sie sich in Ihrem Wunschbereich. Wir bieten Ihnen arbeitsmarktnahe Teilqualifizierung in verschiedenen Fachrichtungen. Die Inhalte haben direkten Bezug zu anerkannten Ausbildungsberufen.
Jobcoaching

Fokus Praxis: Sie arbeiten und lernen unter realen Bedingungen. Die Jobcoaches begleiten Sie auf dem Weg zu Ihrem Ziel.
Werkstatt Transfer

Ziel der Werkstatt Transferleistung ist es, die Fähigkeiten zur Teilhabe am Arbeitsleben zu erhalten und zu stärken.
Campus Mensch

Fokus Praxis: Sie arbeiten und lernen unter realen Bedingungen.

Über gezielte, begleitete Praktika bieten wir Ihnen die Chance, sich auf dem allgemeinen Arbeitsmarkt zu orientieren. Spezifische Fähigkeiten und Fertigkeiten werden am Arbeitsplatz auf- und ausgebaut und arbeitsplatzrelevante Inhalte geschult.

",manually,394,536,35,43,"[Das Ziel der GWW ist:
, Alle Menschen sollen gemeinsam leben und arbeiten können.
, Bei der GWW gibt es angepasste Arbeitsplätze 
für Menschen mit Behinderung 
und Menschen mit einer psychischen Erkrankung. 
, Die Job-Coaches unterstützen Sie 
auf Ihrem Weg auf den Arbeitsmarkt.
, Arbeitsangebote

, Bei der GWW gibt es viele Arbeits-Angebote.
, Sie können

mit Menschen arbeiten
im Büro arbeiten
in der Produktion und Montage arbeiten
mit Holz arbeiten
mit Metall arbeiten
im Freien arbeiten
in der Logistik arbeiten
mit Tieren arbeiten.... und viele andere Tätigkeiten kann man bei der GWW machen.
, Zusätzliche Tätigkeiten

, Sie möchten mehr tun, als Ihre tägliche Arbeit bei der GWW?
, Dann gibt es interessante zusätzliche Tätigkeiten:

Regal-Prüfer
Aufzugs-Wärter
Werkstatt-Rat
Brandschutz-Helfer
Sicherheits-Beauftragter
Kultur-Vermittler
Campus Mensch, Redaktion
, Werkstatt-Entgelt

, Die GWW bezahlt Ihnen mehr Geld 
als viele andere Werkstätten.

, Die Beträge für:

die gesetzliche Kranken-Versicherung
die Pflege-Versicherung
die Renten-Versicherung
werden ebenfalls bezahlt.
, Persönliche Bildung

, Die GWW hilft Ihnen dabei, 
Ihre Fähigkeiten weiter zu entwickeln.
, Dafür gibt es viele Angebote.
, Diese Angebote sollen Ihnen helfen, 
Ihren Alltag selbstbewusst zu meistern.
, Zum Beispiel, indem Sie Lesen, Schreiben und Rechnen lernen.
, Fortbildung und Weiterbildung

, Sie möchten sich beruflich weiter entwickeln?
, Die GWW bietet viele Fortbildungen und Weiterbildungen an.
, Qualifizierungen

, Sie können bei der GWW 
Teil-Qualifizierungen in verschiedenen Berufs-Bereichen machen.
, Das sind Teile einer anerkannten Berufs-Ausbildung.

, Job-Coaching

, Die Job-Coaches unterstützen Sie 
bei der Suche nach einem Arbeitsplatz.
, Durch verschiedene Praktika 
können Sie ausprobieren, 
welche Arbeit Ihnen Spaß macht und zu Ihnen passt.

, Werkstatt Transfer

, Das Angebot Werkstatt Transfer hilft Menschen,
die bei der Arbeit in der Werkstatt
mehr Hilfe brauchen.
, Campus, Mensch

, Wir helfen Ihnen
bei der Suche nach einem Arbeitsplatz
auf dem allgemeinen Arbeitsmarkt.
, Wir begleiten Sie
bei Ihren Praktika vor Ort.
, Mit unserer Hilfe lernen Sie am Arbeitsplatz die Arbeiten,
die Sie an dem Arbeitsplatz können müssen.]","[Sie leisten sinnvolle Arbeit, entwickeln soziale Kontakte und Kompetenzen., Dabei achten wir immer darauf, Ihren Wünschen an einen Arbeitsplatz, Ihren Fähigkeiten und Neigungen zu entsprechen., Bei uns finden Sie angepasste Arbeitsplätze und Vorrichtungen und erhalten Ihre nötige persönliche Unterstützung und Hilfe., Die GWW hilft Ihnen gesellschaftliche Teilhabe und individuelle Selbstbestimmung zu realisieren., Wir bieten Ihnen umfassende Qualifizierungs- und Bildungsangebote., Unsere Jobcoaches unterstützen Sie auf Ihrem Weg auf den Arbeitsmarkt., Alle Menschen sollen gemeinsam leben und arbeiten können:, Das ist unsere Vision.
, Arbeitsangebote

, Wir bieten Ihnen eine breite Palette an Tätigkeiten., Bei uns können Sie Ihre Fähigkeiten ausschöpfen und erhalten Anerkennung für Ihre Leistung. 
, Sie haben die Wahl:

mit Menschen zu arbeiten
im Büro zu arbeiten
in der Produktion und Montage zu arbeiten
mit Holz zu arbeiten
mit Metall zu arbeiten
im Freien zu arbeiten
in der Logistik zu arbeiten.
, Weitere individuelle Lösungen sind möglich, wie z.B. Tätigkeiten mit Tieren...
Zusatztätigkeiten

, Wenn Sie sich über Ihre tägliche Arbeit in der GWW hinaus engagieren möchten, bieten wir Ihnen eine Vielzahl interessanter Zusatztätigkeiten:

Regalprüfer
Aufzugswärter
Werkstattrat
, Brandschutz-Helfer
Sicherheitsbeauftragter
Kulturvermittler
Campus, Mensch, Redaktion

, Werkstattentgelt

, Nach § 219 Sozialgesetzbuch Neuntes Buch (SGB IX) bezahlen wir den Menschen mit Behinderung ein ihrer Leistung angemessenes Arbeitsentgelt und liegen hierbei weit über dem Bundesdurchschnitt.

, Für Ihre Tätigkeit im Reha-Arbeitsbereich der Werkstatt erhalten Sie ein Entgelt auf Basis der mit dem Gesamtwerkstattrat vereinbarten Entgeltvereinbarung., Dieses teilt sich auf in gesetzlich vorgeschriebenes Grundentgelt plus eine Leistungszulage., Sie sind darüber hinaus in der gesetzlichen Krankenversicherung, Pflegeversicherung und Rentenversicherung versichert., Es fallen für Sie keine Beiträge an;, diese werden komplett übernommen.

, Persönliche Bildung

, Sie möchten selbstbewusst Ihren Alltag gestalten?, Die GWW unterstützt Sie dabei, Ihre Fähigkeiten weiterzuentwickeln und durch ständiges Anwenden zu erhalten., Lesen, Schreiben und Rechnen sind Kenntnisse, die über die Arbeit hinaus im Alltag benötigt werden., Sie können weitere Angebote wählen, die Ihnen helfen, Ihren Alltag zu meistern.
 
Fort- und Weiterbildung

Sie möchten sich beruflich weiterentwickeln?, Sie möchten in einem neuen Tätigkeitsfeld arbeiten?, Sie möchten neue Aufgaben übernehmen?, Wir bieten Ihnen zur Qualifizierung oder beruflichen Weiterentwicklung ein großes Fort- und Weiterbildungsangebot.
 , Qualifizierungen

Qualifizieren Sie sich in Ihrem Wunschbereich., Wir bieten Ihnen arbeitsmarktnahe Teilqualifizierung in verschiedenen Fachrichtungen., Die Inhalte haben direkten Bezug zu anerkannten Ausbildungsberufen.
, Jobcoaching

Fokus Praxis: Sie arbeiten und lernen unter realen Bedingungen., Die Jobcoaches begleiten Sie auf dem Weg zu Ihrem Ziel.
, Werkstatt Transfer

Ziel der Werkstatt Transferleistung ist es, die Fähigkeiten zur Teilhabe am Arbeitsleben zu erhalten und zu stärken.
, Campus, Mensch

Fokus, Praxis: Sie arbeiten und lernen unter realen Bedingungen.

, Über gezielte, begleitete Praktika bieten wir Ihnen die Chance, sich auf dem allgemeinen Arbeitsmarkt zu orientieren., Spezifische Fähigkeiten und Fertigkeiten werden am Arbeitsplatz auf- und ausgebaut und arbeitsplatzrelevante Inhalte geschult.

]"
1,1,www.gww-netz.de,Bildung,"Sie möchten neue Dinge lernen?
Sie möchten Ihre Arbeit gut können?

In der GWW können Sie das.
Wir haben viele Angebote für Sie.
Wir bringen Ihnen neue Dinge bei.
Und wir helfen Ihnen bei der Arbeit.

Sie sagen uns, was Ihnen Spaß macht.
Wir finden zusammen das richtige Angebot für Sie.
Wir haben verschiende Angebote für verschiedene Menschen,
unabhängig von ihrer Behinderung.

Da ist für alle das Richtige dabei.
Uns ist es sehr wichtig, dass Sie bei uns zufrieden sind.

Eingangsverfahren

Sie sind bis zu 3 Monate bei uns. 
In dieser Zeit finden wir gemeinsam heraus, 
was Sie schon alles können. 
Wir reden gemeinsam über Ihre Ziele. 
Und versuchen die Ziele gemeinsam zu erreichen. 
Dazu machen wir mit Ihnen einen Plan. 
In diesem Plan steht, welche Ziele Sie erreichen möchten. 
Und wie Sie die Ziele erreichen können. 
Unser Ziel ist es, dass Sie eine Arbeit finden. 
Eine Arbeit die Sie können und die Ihnen Spaß macht. 
Wir schauen, ob Sie in den Berufs-Bildungs-Bereich gehen können. 
Dort können Sie sich auf einen Arbeitsplatz vorbereiten. 
Sie haben Fragen? 
Sie können sich bei uns melden.

Berufs-Bildungs-Bereich

Der Berufs-Bildungs-Bereich heißt auch BBB. 
Im BBB können Sie sich auf eine Arbeit vorbereiten. 
Sie können ein Praktikum machen. 
Oder bei einem Projekt mitmachen. 
Dadurch lernen Sie verschiedene Arbeiten kennen. 
Und finden einen Arbeitsplatz, der Ihnen gefällt. 
Sie sind 1 bis 2 Jahre im BBB.

Berufs-Bildungs-Bereich

Der Berufs-Bildungs-Bereich heißt auch BBB. 
Im BBB können Sie sich auf eine Arbeit vorbereiten. 
Sie können ein Praktikum machen. 
Oder bei einem Projekt mitmachen. 
Dadurch lernen Sie verschiedene Arbeiten kennen. 
Und finden einen Arbeitsplatz, der Ihnen gefällt. 
Sie sind 1 bis 2 Jahre im BBB.

2. Jahr: Aufbau-Kurs BBB

Im Aufbaukurs bereiten Sie sich auf einen Arbeitsplatz vor. 
Sie lernen Dinge, die Sie für den Arbeitslatz brauchen. 
Sie lernen, wie Sie sich richtig bewerben. 
Wir helfen Ihnen, einen Arbeitsplatz für Sie zu finden. 
Sie können in der GWW arbeiten. 
Oder auch in einer anderen Werkstatt. 
Sie können auf einem Werkstattplatz in einem anderen Unternehmen arbeiten. 
Oder in einem Integrations-Unternehmen. 
In einem Integrations-Unternehmen arbeiten Menschen 
mit und ohne Behinderung. 
Wir helfen Ihnen bei der Bewerbung, 
wenn Sie auf dem allgemeinen Arbeitsplatz arbeiten wollen.

Fort- und Weiterbildung

für Menschen mit Behinderung und Personal

Sie wollen neue Arbeiten kennen lernen? 
Sie wollen andere Dinge ausprobieren? 
Sie möchten etwas Neues lernen? 
Bei uns können Sie das. 
Sie können sich bei uns weiterbilden. 
Sie lernen in kleinen Gruppen neue Dinge. 
Sie verbessern das was Sie schon können. 
Dadurch bekommen Sie mehr Sicherheit bei dem was Sie tun. 
Bei uns können Sie lernen was Sie möchten. 
Sie können aus verschiedenen Bildungs-Angeboten auswählen. 
Sie können das Gelernte bei Ihrer Arbeit benutzen. 
Aber auch im Alltag.

Qualifizierungen

Bei der GWW können Sie sich qualifizieren. 
Qualifizieren heißt sich weiterbilden. 
Wir möchten, dass Sie dadurch einen Arbeitsplatz finden. 
Einen Arbeitsplatz den Sie mögen. 
Und der Ihnen Spaß macht. 
Deshalb gibt es verschiedene Weiterbildungen. 
Sie lernen so viel Sie können. 
Und so viel Sie wollen. 
Damit Sie Ihr eigenes Ziel erreichen können.

Alltagsbetreuer

mit staatlich anerkanntem Abschluss

Sie mögen andere Menschen. 
Sie mögen es sich mit anderen Menschen zu unterhalten. 
Sie helfen gerne anderen Menschen.

Dann möchten Sie vielleicht Alltagsbetreuer werden. 
Die Qualifizierung in der GWW dauert 2 Jahre.

Sie lernen anderen Menschen im Alltag zu helfen. 
Sie helfen anderen Menschen beim Einkaufen. 
Sie helfen ihnen bei der Freizeitgestaltung.

Sie können sich um verschiedene Menschen kümmern. 
Sie können sich um alte Menschen kümmern. 
Oder um Menschen in einer Wohngruppe. 
Oder um Menschen im Förder- und Betreuungsbereich. 
Sie haben dabei immer Unterstützung von einer Fachkraft.

Nach 2 Jahren machen Sie eine Abschlussprüfung. 
Wenn Sie die Prüfung bestehen, bekommen Sie ein Zeugnis. 
Nach der Prüfung sind Sie staatlich anerkannter Alltagsbetreuer. 
Dann können Sie überall in Deutschland als Alltagsbetreuer arbeiten.

Die Qualifizierung zum Alltagsbetreuer ist ein duales System. 
Das heißt, Sie sind abwechselnd in der Schule und bei der Arbeit.

1 Woche im Monat sind Sie in der Schule. 
Dort lernen Sie in kleinen Gruppen zusammen. 
Sie haben verschiedene Unterrichtsfächer:

Alltagsbetreuung
Gesundheitslehre und Pflege
Praxis- und Methodenlehre
Rechts- und Berufskunde
Deutsch und Mathematik
Religion
3 Wochen im Monat arbeiten Sie in einer Praxis-Stelle. 
Eine Praxis-Stelle ist zum Beispiel der Förder- und Betreuungsbereich.

Fachlageristen

Sie können sich zum Fachlagerist weiterbilden. 
Diese Weiterbildung braucht 2 Jahre.

Am Ende machen Sie eine Prüfung. 
Wenn Sie die Prüfung bestehen bekommen Sie ein Zeugnis. 
In dem Zeugnis steht wie gut Sie sind. 
Dieses Zeugnis bekommen Sie von der Industrie- und Handelskammer. 
Und es wird staatlich anerkannt. 
Dadurch können Sie überall in Deutschland als Fachlagerist arbeiten.

Die Weiterbildung zum Fachlagerist ist ein duales System. 
Das heißt, Sie sind abwechselnd in der Schule und in einem Lager.

1 bis 2 Wochen im Monat sind Sie in der Schule. 
Dort lernen Sie in kleinen Gruppen. 
Sie haben verschiedene Unterrichtsfächer:

Wirtschafts- und Sozialkunde
Warenwirtschaft und Rechnungswesen
Fachkunde Lagerwirtschaft
Persönlichkeitsförderung
Sie werden von uns beim Lernen unterstützt. 
Wir helfen Ihnen wenn Sie Probleme beim Lernen haben.

2 bis 3 Wochen im Monat sind Sie in einem Lager. 
Sie sind in einem Lager von uns. 
Oder in einem Lager von einem anderen Betrieb. 
Sie lernen wie die Fahrzeuge im Lager funktionieren. 
Sie bekommen Hilfe von den Arbeitern im Lager.

Verkäufer im Einzelhandel

Sie wollen in einem Supermarkt oder in einer Bäckerei arbeiten? 
Ihnen macht es Spaß mit anderen Menschen zusammen zu sein?

Dann können Sie Verkäufer werden. 
Die Qualifizierung geht mindestens 2 Jahre. 
Sie lernen wie man in einem Betrieb arbeitet. 
Und wie Sie die Waren bestellen und überprüfen. 
Sie lernen auch wie man mit Kunden umgeht. 
Und wie man Kunden berät und hilft.

Am Ende Ihrer Qualifizierung machen Sie eine Prüfung. 
Wenn Sie die Prüfung bestehen, bekommen Sie ein Zeugnis. 
Das Zeugnis bekommen Sie von der Industrie- und Handelskammer. 
Dieses Zeugnis wird staatlich anerkannt. 
Somit können Sie überall in Deutschland als Verkäufer arbeiten.

Die Qualifizierung zum Verkäufer ist ein duales System. 
Das heißt, Sie sind abwechselnd in der Schule und in einem Betrieb.

1 bis 2 Wochen sind Sie in der Schule. 
Dort lernen Sie in kleinen Gruppen für die Prüfung. 
Wir beachten dabei Ihre Stärken und auch Ihre Schwächen.

2 bis 3 Wochen sind Sie in einem Betrieb. 
Dies kann zum Beispiel der CAP-Markt sein. 
Dort können Sie das Gelernte bei der Arbeit benutzen.

Persönliche Bildung

Wir helfen Ihnen neue Dinge zu lernen. 
Dabei beachten wir Ihre Bedürfnisse. 
Und was Sie schon alles können. 
Sie können Lesen lernen. 
Sie können Schreiben lernen. 
Sie können Rechnen lernen. 
Das ist wichtig für die Arbeit. 
Und das ist wichtig für Ihren Alltag. 
Wir haben verschiedene Angebote. 
Sie können selber Angebote auswählen. 
Je nach dem, wo Sie noch Hilfe brauchen. 
Sie können lernen, wie Sie sich selber versorgen können. 
Das heißt, Sie lernen Lebensmittel einzukaufen 
und sich damit etwas zu kochen. 
Auch lernen Sie, wie man Wäsche wäscht. 
Und wie man die Wohnung sauber hält. 
Sie können lernen, wie Sie Ihr Geld richtig benutzen. 
Damit Sie nicht zu viel Geld ausgeben. 
Sie lernen auch, wie man Formulare richtig ausfüllt. 
Und wie man Verträge macht. 
Wir helfen Ihnen beim Lernen.

GWW-Jobcoaching

Wir möchten, 
dass Sie eine Arbeit auf dem allgemeinen Arbeitsmarkt finden können. 
Dabei hilft Ihnen das Job-Coaching. 
Sie machen ein Praktikum. 
In einem Praktikum gehen Sie für eine kurze Zeit in einen Betrieb. 
Dadurch können Sie verschiedene Berufe kennen lernen. 
Und Sie lernen, was dort gearbeitet wird. 
So finden Sie heraus, welche Arbeit Ihnen Spaß macht. 
Sie können Betriebe auf dem allgemeinen Arbeitsmarkt kennen lernen. 
Oder verschiedene Arbeiten in der Werkstatt ausprobieren. 
Unsere Job-Coaches helfen Ihnen dabei. 
Job-Coaches sind Menschen die Ihnen helfen Ihr Ziel zu erreichen. 
Und die Sie auf einen Arbeitsplatz vorbereiten. 
Die Job-Coaches begleiten Sie beim Praktikum 
und bei allen anderen Dingen. 
Wir wollen, dass Sie eine gute Arbeit finden. 
Eine die Ihnen Spaß macht!

Unterstützte Beschäftigung

InbeQ ist eine Abkürzung und bedeutet: 
Individuelle betriebliche Qualifizierung.

Eine Qualifizierung hilft Ihnen dabei, 
eine bestimmte Aufgabe erfüllen zu können. 
Individuell heißt, 
die Qualifizierung wird an die einzelne Person angepasst. 
InbeQ findet im Rahmen der unterstützten Beschäftigung statt. 
InbeQ ist im Auftrag der Agentur für Arbeit. 
InbeQ ist für Menschen mit Behinderung, 
die besonders bei der beruflichen Beschäftigung 
unterstützt werden müssen.

KoBV

KoBV ist eine Abkürzung. 
Das lange Wort dafür ist: 
Kooperative berufliche Bildung und Vorbereitung 
auf den allgemeinen Arbeitsmarkt. 
KoBV bereitet Menschen auf den Beruf vor. 
KoBV ist im Auftrag der Agentur für Arbeit.

Wer bereitet mich vor?

Das Job-Coaching innerhalb KoBV 
wird gemeinsam durchgeführt von:

der GWW GmbH
der 1a Zugang Beratungsgesellschaft
Ein Job-Coach ist eine Person, 
die Ihnen hilft, 
sich auf einen Arbeitsplatz vorzubereiten. 
Der Job-Coach begleitet Sie beim Praktikum.

Bei was werde ich unterstützt?

KoBV unterstützt Menschen bei:

der beruflichen Bildung
der Vorbereitung auf den allgemeinen Arbeitsmarkt

Bei was werde ich unterstützt?

KoBV unterstützt Menschen bei:

der beruflichen Bildung
der Vorbereitung auf den allgemeinen Arbeitsmarkt",Bildung,"Bildung ist Grundlage einer lebenslangen Teilhabe in der Gesellschaft

Die GWW hält unterschiedliche Bildungsangebote in den Landkreisen Böblingen und Calw vor. Über den Weg der beruflichen Qualifizierung und Weiterbildung fördert und schafft die GWW Teilhabe für Menschen mit Behinderungen, mit Autismus oder mit seelischen Erkrankungen. Dies gilt für die weitgehend selbstbestimmte Lebensgestaltung oder für die Vorbereitung auf einen Arbeitsplatz.

Wir achten stets darauf, dass neben der Fachkompetenz auch die Entwicklung der Persönlichkeit und des Selbstbewusstseins Beachtung finden. Unsere Bildungsangebote bauen auf bisher erworbenen Fähigkeiten, Fertigkeiten und Kompetenzen auf und sorgen für deren Erhalt und Weiterentwicklung. Durch gezielte Maßnahmen steigern wir Ihre Handlungsfähigkeit und damit auch die Zufriedenheit am Arbeitsplatz.

Die Förderung erfolgt im Rahmen einer individuellen Zielplanung. Die Inhalte entwickeln wir stets zusammen mit Ihnen als Teilnehmende.

Mit unserem umfassenden Angebot ermöglichen wir lebenslange Bildung. Dieser Anspruch gilt für alle Menschen in der GWW unabhängig von ihrer Behinderung. Unsere Bildungsangebote sind daher auch für Menschen mit Autismus in unterschiedlichen Ausprägungen zugänglich.

Eingangsverfahren

In einer maximal 3-monatigen Phase ermitteln wir die kognitiven und motorischen Fähigkeiten unserer Teilnehmer.

Auf Basis der persönlichen Ergebnisse vereinbaren die Fachkräfte gemeinsam mit dem Teilnehmenden individuelle Ziele und erstellen einen passgenauen Eingliederungsplan.

Es wird gemeinsam geprüft, ob der Berufsbildungsbereich die geeignete Maßnahme auf dem Weg zur beruflichen Orientierung und Platzierung darstellt.


Berufs-Bildungs-Bereich

Erwachsene Menschen mit einer Behinderung, Autismus oder seelischen Erkrankungen haben im BBB die Möglichkeit, sich beruflich zu orientieren und zu qualifizieren.

Es werden kognitive Fähigkeiten trainiert und motorische Fertigkeiten ausgebaut. Soziale Kompetenzen werden weiterentwickelt und die Persönlichkeit wird gestärkt und gefördert.

Die Eingliederungsplanung wird fortgeschrieben und bietet die Grundlage der beruflichen Orientierung und Qualifizierung. Dabei arbeitet die GWW auf Basis bundesweit anerkannter Berufsbilder.

Durch entsprechende Schulungsmodule, Projekte und Praktika lernen die Teilnehmer in maximal zwei Jahren selbstständiges und gezieltes Arbeiten.

Ziel ist es, einen geeigneten Arbeits-, Ausbildungsplatz oder eine Qualifizierungsmaßnahme zu finden.

1. Jahr: Grund-Kurs BBB

Im Grundkurs verbessern Sie das, was Sie schon können.
Sie sind mit anderen Menschen zusammen.
Dadurch lernen Sie mit anderen Menschen zu arbeiten.
Und mit anderen Menschen umzugehen.
Sie können verschiedene Arbeiten kennenlernen.
Und auch verschiedene Berufe.
Dadurch können Sie eine Arbeit finden, die Ihnen Spaß macht.

2. Jahr: Aufbau-Kurs BBB

Im Aufbaukurs bereiten Sie sich auf einen Arbeitsplatz vor.
Sie lernen Dinge, die Sie für den Arbeitslatz brauchen.
Sie lernen, wie Sie sich richtig bewerben.
Wir helfen Ihnen, einen Arbeitsplatz für Sie zu finden.

Sie können in der GWW arbeiten.
Oder auch in einer anderen Werkstatt.
Sie können auf einem Werkstattplatz in einem anderen Unternehmen arbeiten.
Oder in einem Integrations-Unternehmen.
In einem Integrations-Unternehmen arbeiten Menschen 
mit und ohne Behinderung.

Wir helfen Ihnen bei der Bewerbung,
wenn Sie auf dem allgemeinen Arbeitsplatz arbeiten wollen.

Fort- und Weiterbildung

für Menschen mit Behinderung und Personal

Sie möchten sich beruflich weiterentwickeln?
Sie möchten in einem neuen Tätigkeitsfeld arbeiten?
Sie möchten neue Aufgaben übernehmen?

Unser weites Spektrum an Fort- und Weiter­bildungs­angeboten ist sowohl auf Ihren persönlichen Bedarf als Mitarbeiter als auch an den Anforderungen am Arbeitsplatz ausgerichtet. Die Angebote sind immer themenorientiert, schrittweise aufgebaut und können individuell belegt werden. Ein Teil unserer Schulungen findet integrativ statt.

