,Unnamed: 0,website,title_leicht,text_leicht,title_normal,text_normal,source,token_leicht,token_normal,sents_leicht,sents_normal,text_leicht_sents,text_normal_sents
Die flexibel buchbaren Räume sind der Ort, wo Neugründer, Start-ups, Studenten und Unternehmen, zum Beispiel aus dem Bereich Medizintechnik, arbeiten und voneinander profitieren können. Der Coworking Space Checkpoint Campus bietet barrierefreie, professionell ausgestattete Räumlichkeiten und eine leistungsstarke Infrastruktur. Bis dahin unterscheidet sich das neue Angebot nicht von den Lösungen anderer Anbieter. „Wir möchten den Mietern einen Mehrwert bieten, den sie sonst nirgends erhalten“, erklärt Andrea Stratmann, Geschäftsführerin der GWW, „und deshalb wollen wir das Know-How der GWW ebenso einbringen, wie unsere gute Vernetzung vor Ort. Denn wir sind auch an Kooperationsprojekten und längerfristiger Zusammenarbeit interessiert.“ So können die Coworker von allen Dienstleistungen des Campus Mensch profitieren. Dazu gehören Montage-, Verpackungs- und Produktionsdienstleistung, Digitaldruck inhouse, Scannen, Digitalisieren, Logistik, Unterstützung durch Menschen mit Behinderung und weitere Dienstleistungen.

Partnerschaft mit Senioren der Wirtschaft

Dazu kommt die Partnerschaft mit den Senioren der Wirtschaft, die mit mehr als 50 ehemaligen Unternehmern und Führungskräften aus der Wirtschaft Neugründer professionell unterstützen können. „Wir begleiten den gesamten Gründungsprozess: von der Konzeptentwicklung über die Erstellung eines Businessplans bis zur Kapitalbeschaffung. Zudem stehen wir als Sparringpartner und Mentor zur Verfügung“, erläutert Wolfgang Vogt, der seit 2011 in dem gemeinnützigen Verein mitarbeitet und Vorstandsmitglied ist.

Räume und Möglichkeiten

Zu Beginn steht den Interessenten nun eine Fläche von über 150 m² mit Gemeinschaftsbüros, Einzelarbeitsplätzen und Kreativ- und Meetingräumen mit flexibler Innenraumgestaltung an unserem Gründungsstandort in der Waldenbucher Straße 34-36 in 71065 Sindelfingen zur Verfügung. Bis Jahresende ist geplant, diese Fläche auf insgesamt 700 m² zu erhöhen. Erst in den vergangenen drei Jahren wurde der Standort grundsaniert und teilweise neu gebaut. Insgesamt 240 Menschen mit Behinderung arbeiten dort an Produkten für die Automobilindustrie, für kleinere und mittelständische Unternehmen und erbringen Dienstleistungen im Bereich Drucken und Digitalisieren unter anderem für Behörden. Darüber hinaus beliefert die GWW auch Medizingerätehersteller, weshalb im Herbst eine Zertifizierung in diesem Bereich ansteht. „Wir sind seit Jahren Partner für Unternehmen aus dem Bereich Medizintechnik und möchten dies durch unsere Zertifizierung untermauern“, sagt die Geschäftsführerin, „Und damit können wir einerseits nächste Schritte in der Kooperation mit den Unternehmen gehen, als auch Gründern aus dem Gesundheitsbereich zusätzliche Möglichkeiten der Zusammenarbeit bieten.“


 
Raum Innovation 2
 
Raum Innovation 1
 
Einzelbüro
www.coworking-campus-mensch.de 
Campus Mensch
Campus Mensch mit den rechtlich eigenständigen sozialen Unternehmen Femos gGmbH, 1a Zugang Beratungsgesellschaft mbH, GWW Gemeinnützige Werkstätten und Wohnstätten GmbH und der Stiftung Zenit ist eine ideelle Gemeinschaft in der Region Stuttgart. Gemeinsam arbeiten wir an unserer Vision einer gleichberechtigten Teilhabe aller in einer barrierefreien Gesellschaft. Dafür bieten wir Menschen mit Nachteilen Bildungsangebote, Arbeitsplätze, Wohnarrangements und die passende Förderung und Betreuung. ",manually,165,562,15,30,"[Neues Angebot von Campus, Mensch

Campus, Mensch hat viele verschiedene Angebote
für externe Kunden.
, Zum Beispiel:

Montage
Scannen
Digitalisieren
Logistik
, Jetzt hat Campus Mensch
ein tolles neues Angebot.
, Das Angebot heißt:
Coworking Space.
, Das ist Englisch,
und wir sprechen es so aus:
Cowörking Späis.
, Das sind Arbeits-Räume.


 
 
 
, Jedes Unternehmen kann diese Räume buchen.
, Aber auch Studenten können die Räume nutzen.
, Die Arbeits-Plätze in den Räumen
können für Tage,
Monate oder Jahre gebucht werden.
, Es gibt Kaffee und Wasser
und die Arbeits-Plätze haben alle Technik,
die gebraucht wird.


 
 
 
, Die Möbel haben Teilnehmer 
aus dem Berufs-Bildungs-Bereich
in Gärtringen hergestellt.
, Sie bestehen aus Paletten.
, Natürlich können
die Unternehmen und Studenten
auch noch die anderen Angebote
von Campus Mensch nutzen.]","[Mit dem Checkpoint Campus eröffnete die GWW in Sindelfingen den ersten inklusiven Coworking Space in der Region Stuttgart., Er verspricht den Nutzern eine temporäre Heimat in sozialer Gemeinschaft., Denn durch die Anbindung an die GWW und deren regionale Vernetzung ergibt sich für die Nutzer ein Mehrwert, der über die Bereitstellung temporärere Arbeitsflächen deutlich hinausgeht. 


 
, Gemeinschaftsbüro
 
Raum, Innovation 1
 
Raum, Innovation 2
, Die flexibel buchbaren Räume sind der Ort, wo Neugründer, Start-ups, Studenten und Unternehmen, zum Beispiel aus dem Bereich Medizintechnik, arbeiten und voneinander profitieren können., Der Coworking Space Checkpoint Campus bietet barrierefreie, professionell ausgestattete Räumlichkeiten und eine leistungsstarke Infrastruktur., Bis dahin unterscheidet sich das neue Angebot nicht von den Lösungen anderer Anbieter., „Wir möchten den Mietern einen Mehrwert bieten, den sie sonst nirgends erhalten“, erklärt Andrea Stratmann, Geschäftsführerin der GWW, „und deshalb wollen wir das Know-How der GWW ebenso einbringen, wie unsere gute Vernetzung vor Ort., Denn wir sind auch an Kooperationsprojekten und längerfristiger Zusammenarbeit interessiert.“, So können die Coworker von allen Dienstleistungen des Campus Mensch profitieren., Dazu gehören Montage-, Verpackungs- und Produktionsdienstleistung, Digitaldruck inhouse, Scannen, Digitalisieren, Logistik, Unterstützung durch Menschen mit Behinderung und weitere Dienstleistungen.

, Partnerschaft mit Senioren der Wirtschaft

, Dazu kommt die Partnerschaft mit den Senioren der Wirtschaft, die mit mehr als 50 ehemaligen Unternehmern und Führungskräften aus der Wirtschaft Neugründer professionell unterstützen können., „Wir begleiten den gesamten Gründungsprozess: von der Konzeptentwicklung über die Erstellung eines Businessplans bis zur Kapitalbeschaffung., Zudem stehen wir als Sparringpartner und Mentor zur Verfügung“, erläutert Wolfgang Vogt, der seit 2011 in dem gemeinnützigen Verein mitarbeitet und Vorstandsmitglied ist.

Räume und Möglichkeiten

, Zu Beginn steht den Interessenten nun eine Fläche von über 150 m² mit Gemeinschaftsbüros, Einzelarbeitsplätzen und Kreativ- und Meetingräumen mit flexibler Innenraumgestaltung an unserem Gründungsstandort in der Waldenbucher Straße 34-36 in 71065 Sindelfingen zur Verfügung., Bis Jahresende ist geplant, diese Fläche auf insgesamt 700 m² zu erhöhen., Erst in den vergangenen drei Jahren wurde der Standort grundsaniert und teilweise neu gebaut., Insgesamt 240 Menschen mit Behinderung arbeiten dort an Produkten für die Automobilindustrie, für kleinere und mittelständische Unternehmen und erbringen Dienstleistungen im Bereich Drucken und Digitalisieren unter anderem für Behörden., Darüber hinaus beliefert die GWW auch Medizingerätehersteller, weshalb im Herbst eine Zertifizierung in diesem Bereich ansteht., „Wir sind seit Jahren Partner für Unternehmen aus dem Bereich Medizintechnik und möchten dies durch unsere Zertifizierung untermauern“, sagt die Geschäftsführerin, „Und damit können wir einerseits nächste Schritte in der Kooperation mit den Unternehmen gehen, als auch Gründern aus dem Gesundheitsbereich zusätzliche Möglichkeiten der Zusammenarbeit bieten.“


 
, Raum Innovation 2
 
Raum, Innovation 1
 
Einzelbüro
, www.coworking-campus-mensch.de 
Campus, Mensch
Campus, Mensch mit den rechtlich eigenständigen sozialen Unternehmen Femos gGmbH, 1a Zugang Beratungsgesellschaft mbH, GWW Gemeinnützige Werkstätten und Wohnstätten GmbH und der Stiftung Zenit ist eine ideelle Gemeinschaft in der Region Stuttgart., Gemeinsam arbeiten wir an unserer Vision einer gleichberechtigten Teilhabe aller in einer barrierefreien Gesellschaft., Dafür bieten wir Menschen mit Nachteilen Bildungsangebote, Arbeitsplätze, Wohnarrangements und die passende Förderung und Betreuung.]"
20,20,www.gww-netz.de,Umwelt schützen,"Wie schützt die GWW die Umwelt


Es ist wichtig, die Umwelt zu schützen.
Auch die GWW achtet auf die Umwelt.
Die Mitarbeiter der GWW vermeiden Abfall.
Und sie trennen Abfall
und verwerten ihn weiter.
Sie achten auf den Wasser-Verbrauch.
An manchen Stand-Orten
nutzen sie schon Regen-Wasser.

 
Spätestens 2030
sollen alle Autos
von der GWW elektronisch fahren.
Für die Elektro-Autos
werden schon Lade-Säulen installiert.
Die Mitarbeiter der GWW
achten auch darauf,
weniger Strom zu verbrauchen.
Zum Beispiel durch Lampen,
die weniger Strom verbrauchen.
Das sind nur ein paar Beispiele,
wie die GWW auf die Umwelt achtet.

 

 
Aber auch die anderen Unternehmen
von Campus Mensch achten auf die Umwelt.
Jeder kann etwas tun,
um die Umwelt zu schützen.",Umweltmanagement im Campus Mensch,"2020 wurde stark von den Auswirkungen der Pandemie überschattet. Darüber sind die zuvor überall wahrnehmbaren Umweltthemen fast in Vergessenheit geraten. Daher nehmen die Unternehmen des Campus Mensch, die GWW-Gemeinnützige Werkstätten und Wohnstätten GmbH, Femos gGmbH, 1a Zugang Beratungsgesellschaft mbH und die Stiftung Zenit, das Audit des Umweltmanagementsystems (ISO 14001:2015) der GWW im vergangenen November zum Anlass, über die Ausrichtung der Unternehmen in diesem Bereich zu berichten.

 
Wie wollen wir mit unserer Umwelt umgehen?

Diese Frage stellen sich längst nicht nur Privatpersonen, sondern auch Unternehmen. Denn egal was wir tun, haben wir Verantwortung gegenüber der Umwelt und den uns nachfolgenden Generationen. Auch die Unternehmen des Campus Mensch möchten sich darum diesem wichtigen Thema zentral annehmen. Im Leitbild der GWW ist das Thema Umwelt auf höchster Ebene verortet. Dort heißt es: „Wir bieten unseren internen Kunden, Wirtschaftskunden und Leistungsträgern Qualität, Zuverlässigkeit und innovative Lösungen unter Berücksichtigung eines sorgsamen Umgangs mit der Umwelt.“ Es war ein Anliegen aller, die am Leitbildprozess mitgearbeitet haben. Dazu gehörten verschiedene Menschen des Unternehmens: Menschen mit Behinderung und anderen Nachteilen, Fachkräfte, Leitungen aus allen Bereichen.

Doch wie wirkt sich dieser Abschnitt des Leitbilds im Alltag aus?


Aus dem Leitbild ist unter anderem das Thema Umwelt als Handlungsfeld abgeleitet: Ein Handlungsfeld wirkt in alle Campus Mensch Unternehmen und es kann in allen Unternehmen Personen geben, die sich um dieses Handlungsfeld kümmern. Allerdings werden diese Themen nur dann gelebt, wenn alle Unternehmensmitglieder sie auch zu ihren Zielen machen. D. h. alle sollten in ihren Handlungen den Aspekt des sorgsamen Umgangs mit der Umwelt bedenken. Auch aus dem wirtschaftlichen Handeln ergeben sich besondere Umweltaspekte, deren Auswirkung auf die Umwelt die GWW so gering wie möglich halten will. Dafür werden die Produktionsanlagen sowie die Gebäude an einer Umweltpolitik ausgerichtet.

Was heißt das konkret?

Alle Aspekte können wir an dieser Stelle nicht nennen, daher wollen wir exemplarisch einige Punkte herausgreifen. Grundsätzlich achten wir darauf, Abfall zu vermeiden, zu trennen und zu recyceln. Der Wasserverbrauch wird genau beobachtet und nach Möglichkeit reduziert. An verschiedenen Standorten wird zusätzlich Regenwasser genutzt. An den GWW Werkstandorten wird die innerbetriebliche Logistik ab 2022 CO2-neutral durchgeführt werden. Auch die externe Logistik wird nach und nach, sobald am Markt verfügbar, auf CO2 freie Antriebe umgestellt. Spätestens im Jahr 2030 soll die Fahrzeugflotte der GWW CO2-neutral sein. Bereits jetzt werden bei Neubauten und auch vereinzelt an bestehenden Immobilien beispielsweise Ladesäulen für Elektroautos installiert.

Durch Einsparungen und Optimierungen an vorhandenen Anlagen und auch durch die Nutzung selbst erzeugte Energie streben wir eine Reduzierung des Energieverbrauchs von jährlich 2 % an. Dieser Punkt hat den Auditoren besonders gefallen, dass das Thema CO2 Neutralität jetzt verbindlich in die Umweltpolitik aufgenommen wurde. Über detaillierte Auswertungen kann die aktuelle Entwicklung genauestens beobachtet und bei Bedarf eingegriffen werden. Außerdem bezieht die GWW 100 % Ökostrom. Darüber hinaus kann jeder im Alltag dazu beitragen, Energie einzusparen, beispielsweise indem unnötig brennende Lampen ausgeschaltet werden. Doch auch die Lampen selbst sollen bis 2025 im Arbeitsbereich komplett gegen energieeffiziente LED-Leuchtmittel ausgetauscht werden.

 
Durch all diese Maßnahmen und durch die Unterstützung aller in den Campusunternehmen tätigen Menschen und den Bewohnern der Wohnbereiche wollen wir uns für einen nachhaltigen Umgang mit der Umwelt einsetzen. Damit wollen wir unsere Ziele im Sinne einer sorgsamen Umweltpolitik erreichen.",manually,158,604,14,35,"[Wie schützt die GWW die Umwelt


, Es ist wichtig, die Umwelt zu schützen.
, Auch die GWW achtet auf die Umwelt.
, Die Mitarbeiter der GWW vermeiden Abfall.
, Und sie trennen Abfall
und verwerten ihn weiter.
, Sie achten auf den Wasser-Verbrauch.
, An manchen Stand-Orten
nutzen sie schon Regen-Wasser.

 
, Spätestens 2030
sollen alle Autos
von der GWW elektronisch fahren.
, Für die Elektro-Autos
werden schon Lade-Säulen installiert.
, Die Mitarbeiter der GWW
achten auch darauf,
weniger Strom zu verbrauchen.
, Zum Beispiel durch Lampen,
die weniger Strom verbrauchen.
, Das sind nur ein paar Beispiele,
wie die GWW auf die Umwelt achtet.

 

 
, Aber auch die anderen Unternehmen
von Campus Mensch achten auf die Umwelt.
, Jeder kann etwas tun,
um die Umwelt zu schützen.]","[2020 wurde stark von den Auswirkungen der Pandemie überschattet., Darüber sind die zuvor überall wahrnehmbaren Umweltthemen fast in Vergessenheit geraten., Daher nehmen die Unternehmen des Campus Mensch, die GWW-Gemeinnützige Werkstätten und Wohnstätten GmbH, Femos gGmbH, 1a Zugang Beratungsgesellschaft mbH und die Stiftung Zenit, das Audit des Umweltmanagementsystems (ISO 14001:2015) der GWW im vergangenen November zum Anlass, über die Ausrichtung der Unternehmen in diesem Bereich zu berichten.

 
, Wie wollen wir mit unserer Umwelt umgehen?

, Diese Frage stellen sich längst nicht nur Privatpersonen, sondern auch Unternehmen., Denn egal was wir tun, haben wir Verantwortung gegenüber der Umwelt und den uns nachfolgenden Generationen., Auch die Unternehmen des Campus Mensch möchten sich darum diesem wichtigen Thema zentral annehmen., Im Leitbild der GWW ist das Thema Umwelt auf höchster Ebene verortet., Dort heißt es: „Wir bieten unseren internen Kunden, Wirtschaftskunden und Leistungsträgern Qualität, Zuverlässigkeit und innovative Lösungen unter Berücksichtigung eines sorgsamen Umgangs mit der Umwelt.“, Es war ein Anliegen aller, die am Leitbildprozess mitgearbeitet haben., Dazu gehörten verschiedene Menschen des Unternehmens: Menschen mit Behinderung und anderen Nachteilen, Fachkräfte, Leitungen aus allen Bereichen.

, Doch wie wirkt sich dieser Abschnitt des Leitbilds im Alltag aus?


, Aus dem Leitbild ist unter anderem das Thema Umwelt als Handlungsfeld abgeleitet:, Ein Handlungsfeld wirkt in alle Campus Mensch Unternehmen und es kann in allen Unternehmen Personen geben, die sich um dieses Handlungsfeld kümmern., Allerdings werden diese Themen nur dann gelebt, wenn alle Unternehmensmitglieder sie auch zu ihren Zielen machen., D. h. alle sollten in ihren Handlungen den Aspekt des sorgsamen Umgangs mit der Umwelt bedenken., Auch aus dem wirtschaftlichen Handeln ergeben sich besondere Umweltaspekte, deren Auswirkung auf die Umwelt die GWW so gering wie möglich halten will., Dafür werden die Produktionsanlagen sowie die Gebäude an einer Umweltpolitik ausgerichtet.

, Was heißt das konkret?

, Alle Aspekte können wir an dieser Stelle nicht nennen, daher wollen wir exemplarisch einige Punkte herausgreifen., Grundsätzlich achten wir darauf, Abfall zu vermeiden, zu trennen und zu recyceln., Der Wasserverbrauch wird genau beobachtet und nach Möglichkeit reduziert., An verschiedenen Standorten wird zusätzlich Regenwasser genutzt., An den GWW Werkstandorten wird die innerbetriebliche Logistik ab 2022 CO2-neutral durchgeführt werden., Auch die externe Logistik wird nach und nach, sobald am Markt verfügbar, auf CO2 freie Antriebe umgestellt., Spätestens im Jahr 2030 soll die Fahrzeugflotte der GWW CO2-neutral sein., Bereits jetzt werden bei Neubauten und auch vereinzelt an bestehenden Immobilien beispielsweise Ladesäulen für Elektroautos installiert.

, Durch Einsparungen und Optimierungen an vorhandenen Anlagen und auch durch die Nutzung selbst erzeugte Energie streben wir eine Reduzierung des Energieverbrauchs von jährlich 2 % an., Dieser Punkt hat den Auditoren besonders gefallen, dass das Thema CO2 Neutralität jetzt verbindlich in die Umweltpolitik aufgenommen wurde., Über detaillierte Auswertungen kann die aktuelle Entwicklung genauestens beobachtet und bei Bedarf eingegriffen werden., Außerdem bezieht die GWW 100 % Ökostrom., Darüber hinaus kann jeder im Alltag dazu beitragen, Energie einzusparen, beispielsweise indem unnötig brennende Lampen ausgeschaltet werden., Doch auch die Lampen selbst sollen bis 2025 im Arbeitsbereich komplett gegen energieeffiziente LED-Leuchtmittel ausgetauscht werden.

 
, Durch all diese Maßnahmen und durch die Unterstützung aller in den Campusunternehmen tätigen Menschen und den Bewohnern der Wohnbereiche wollen wir uns für einen nachhaltigen Umgang mit der Umwelt einsetzen., Damit wollen wir unsere Ziele im Sinne einer sorgsamen Umweltpolitik erreichen.]"
21,21,www.gww-netz.de,40 Jahre Wohnheime Sindelfingen und Herrenberg,"Die GWW hat vor 40 Jahren ihre ersten Wohnheime eröffnet. 
Ein Wohnheim in Sindelfingen mit 37 Plätzen und 
ein Wohnheim in Herrenberg mit 36 Plätzen. 
Jetzt haben sie Jubiläum gefeiert.
Leider gab es Corona-Schutz-Maßnahmen und 
deswegen waren keine Gäste eingeladen. 
Die Bewohner und Betreuer 
blieben deshalb unter sich.

 
Die Feier war aber trotzdem sehr schön. 
Es gab Fotos aus alten Zeiten und 
die älteren Bewohner 
erinnerten sich an früher.

Viele Menschen mit Behinderung. 
in den Werkstätten 
wünschten sich früher, 
möglichst selbstbestimmt zu wohnen.

Die GWW eröffnete also ihre ersten Wohnheime 
in Sindelfingen und in Herrenberg. 
Die Selbstständigkeit der Bewohner wurde 
dabei immer auch gefordert und gefördert. 
Dass das nicht immer für jeden einfach war, 
erzählt man sich noch heute.


 
 
 
 
 
Andere Wohnformen kamen bald 
zu den Wohnheimen dazu. 
Das Ambulant Betreute Wohnen ermöglichte 
den Bewohnern eine hohe Eigenständigkeit. 
Passende Angebote gibt es heute für Menschen 
mit verschiedenem Hilfebedarf. 
Auch für ältere Menschen mit Behinderung.
Britta Bender, die in der GWW 
das Geschäftsfelds Wohnen leitet, erklärt: 
„Die Wohnangebote richten sich immer 
nach den Wünschen der Bewohner. 
Wer selbstständig leben möchte, 
soll dies so gut er kann auch dürfen.“",40 Jahre Wohnheime Sindelfingen und Herrenberg,"Auf eine große Feier mit Gästen mussten die Bewohner der Wohnbereiche der GWW in Sindelfingen und Herrenberg in diesem Jahr verzichten. Aufgrund der aktuellen Corona Schutzmaßnahmen blieben die über 100 Bewohner und Betreuer an den verschiedenen Standorten unter sich. Dies tat der Feier keinen Abbruch – es gab Fotos aus alten Zeiten und die älteren Bewohner erinnerten sich an die unterschiedlichen Begebenheiten und Veränderungen in den vergangenen 40 Jahren.

 
Durch die 1980 eingeweihten Wohnheime in Sindelfingen und Herrenberg folgte die GWW dem Wunsch der in den Werkstätten beschäftigten Menschen mit Behinderung. Viele der Mitarbeiter lernten in den Werkstätten über die tägliche Arbeit eine neue Form der Teilhabe kennen. In der Folge hatten sie auch den Wunsch, möglichst selbstbestimmt und unabhängig vom Elternhaus wohnen zu können. Darüber hinaus kamen auch viele Angehörige in ein Alter, in dem sie die Betreuung ihrer Angehörigen mit Behinderung daheim nicht mehr leisten konnten. So eröffneten die Wohnheime in Sindelfingen mit 37 Plätzen und in Herrenberg mit 36 Plätzen ein Wohnangebot, welches mit einer großen Anzahl Einzelzimmern als richtungsweisend galt. Allerdings mussten sowohl die Angehörigen, als auch die Bewohner lernen, dass das Wohnangebot keine Fortführung des bisherigen Familienlebens darstellt. Denn die GWW forderte und förderte immer auch die Selbstständigkeit ihrer Bewohner. Dass das nicht immer für jeden einfach war, erzählt man sich noch heute. So stellte ein Bewohner kurz nach seinem Einzug fest, dass die Betreuerinnen wohl nicht allzu fleißig seien. Darauf angesprochen erklärte der Bewohner: „Stell dir vor, ich stelle abends meine Schuhe vor die Tür und meinst du, die haben sie bis morgens geputzt?“ Unbeirrt davon hielten die Verantwortlichen an der wachsenden Selbstständigkeit der Bewohner fest. Nur wenige Jahre später wurden weitere Wohnformen umgesetzt, die den Bewohnern hohe Eigenständigkeit gewährte. So erkannte die GWW als eine der ersten Einrichtungen bereits in den achtziger Jahren das Potenzial des Ambulant Betreuten Wohnens. Heute gibt es für Menschen jeglichen Hilfebedarfs differenziert abgestimmte Angebote, unabhängig von deren Alter. „Die Wohnangebote richten sich immer nach den Wünschen der Bewohner. Wer selbstständig leben möchte, soll dies im Rahmen seiner Möglichkeiten tun dürfen“, erklärt Britta Bender, Geschäftsfeldleiterin Wohnen in der GWW. So wurde auch an den anderen Wohnstandorten im Landkreis Böblingen kräftig mitgefeiert. Denn sie alle gehen auf die Gründung vor 40 Jahren zurück. Die Bewohner in Herrenberg bemalten Karten, die sie am Nachmittag zeitgleich von allen Standorten aus mit bunten Luftballons in den leider verregneten Himmel steigen ließen.


 
 
 
 
 
Als die ersten Wohnheime der GWW öffneten, lebten die meisten Menschen mit Behinderung in Deutschland hauptsächlich in Einrichtungen außerhalb der Städte. Heimatnahe Wohnangebote gab es so gut wie nicht. So war es nur konsequent, dass die Verantwortlichen der GWW die Wünsche der Bewohner und Angehörigen weiter verfolgten und die vielfältigen Wohnangebote gemeindeintegriert an vielen Stellen der Städte und Gemeinden im Landkreis entwickelte. „So können heute die Menschen im Wohnheim lernen, ihr Leben mitzugestalten und wer es sich zutraut, alleine zu leben, zieht später in eine Außenwohngruppe und anschließend möglicherweise in die eigene Wohnung“, so Bender weiter. „Und wenn die Menschen später im fortgeschrittenen Alter wieder mehr Hilfe benötigen, können die Betreuungszeiten erhöht werden oder sie können in eine enger betreute Wohnform wechseln.“ Dieses Konzept kommt auch bei den Verantwortlichen der Städte und Gemeinden an. So lobte Herrenbergs Oberbürgermeister Thomas Spißler in seinem Grußwort: „Die GWW setzt sich stets für andere ein und bildet gemeinsam eine großartige Gemeinschaft. Alle Menschen sind willkommen und können Teil dieser Gemeinschaft sein. Das ist etwas ganz Wunderbares und alle tragen zusammen dazu bei.“",manually,246,643,17,31,"[Die GWW hat vor 40 Jahren ihre ersten Wohnheime eröffnet. 
, Ein Wohnheim in Sindelfingen mit 37 Plätzen und 
ein Wohnheim in Herrenberg mit 36 Plätzen. 
, Jetzt haben sie Jubiläum gefeiert.
, Leider gab es Corona-Schutz-Maßnahmen und 
deswegen waren keine Gäste eingeladen. 
, Die Bewohner und Betreuer 
blieben deshalb unter sich.

 
, Die Feier war aber trotzdem sehr schön. 
, Es gab Fotos aus alten Zeiten und 
die älteren Bewohner 
erinnerten sich an früher.

, Viele Menschen mit Behinderung. 
in den Werkstätten 
wünschten sich früher, 
möglichst selbstbestimmt zu wohnen.

, Die GWW eröffnete also ihre ersten Wohnheime 
in Sindelfingen und in Herrenberg. 
, Die Selbstständigkeit der Bewohner wurde 
dabei immer auch gefordert und gefördert. 
, Dass das nicht immer für jeden einfach war, 
erzählt man sich noch heute.


 
 
 
 
 
, Andere Wohnformen kamen bald 
zu den Wohnheimen dazu. 
, Das Ambulant Betreute Wohnen ermöglichte 
den Bewohnern eine hohe Eigenständigkeit. 
, Passende Angebote gibt es heute für Menschen 
mit verschiedenem Hilfebedarf. 
, Auch für ältere Menschen mit Behinderung.
, Britta Bender, die in der GWW 
das Geschäftsfelds Wohnen leitet, erklärt: 
„Die Wohnangebote richten sich immer 
nach den Wünschen der Bewohner. 
, Wer selbstständig leben möchte, 
soll dies so gut er kann auch dürfen.“]","[Auf eine große Feier mit Gästen mussten die Bewohner der Wohnbereiche der GWW in Sindelfingen und Herrenberg in diesem Jahr verzichten., Aufgrund der aktuellen Corona Schutzmaßnahmen blieben die über 100 Bewohner und Betreuer an den verschiedenen Standorten unter sich., Dies tat der Feier keinen Abbruch – es gab Fotos aus alten Zeiten und die älteren Bewohner erinnerten sich an die unterschiedlichen Begebenheiten und Veränderungen in den vergangenen 40 Jahren.

 
