,Source,link_leicht,URL,sents_leicht,sents_standard
584,P_manually,,zwischenbericht,Die Möbel haben Teilnehmer aus dem Berufs-Bildungs-Bereich,"Darüber hinaus beliefert die GWW auch Medizingerätehersteller, weshalb im Herbst eine Zertifizierung in diesem Bereich ansteht. „Wir sind seit Jahren Partner für Unternehmen aus dem Bereich Medizintechnik und möchten dies durch unsere Zertifizierung untermauern“, sagt die Geschäftsführerin, „Und damit können wir einerseits nächste Schritte in der Kooperation mit den Unternehmen gehen, als auch Gründern aus dem Gesundheitsbereich zusätzliche Möglichkeiten der Zusammenarbeit bieten.“ Raum Innovation 2 Raum Innovation 1"
585,P_manually,,zwischenbericht,in Gärtringen hergestellt.,Einzelbüro
586,P_manually,,zwischenbericht,Sie bestehen aus Paletten. Natürlich können,"www.coworking-campus-mensch.de Campus Mensch Campus Mensch mit den rechtlich eigenständigen sozialen Unternehmen Femos gGmbH, 1a Zugang Beratungsgesellschaft mbH, GWW Gemeinnützige Werkstätten und Wohnstätten GmbH und der Stiftung Zenit ist eine ideelle Gemeinschaft in der Region Stuttgart."
587,P_manually,,zwischenbericht,die Unternehmen und Studenten auch noch die anderen Angebote von Campus Mensch nutzen.,"Gemeinsam arbeiten wir an unserer Vision einer gleichberechtigten Teilhabe aller in einer barrierefreien Gesellschaft. Dafür bieten wir Menschen mit Nachteilen Bildungsangebote, Arbeitsplätze, Wohnarrangements und die passende Förderung und Betreuung."
588,P_manually,,zwischenbericht,Wie schützt die GWW die Umwelt,"2020 wurde stark von den Auswirkungen der Pandemie überschattet. Darüber sind die zuvor überall wahrnehmbaren Umweltthemen fast in Vergessenheit geraten. Daher nehmen die Unternehmen des Campus Mensch, die GWW-Gemeinnützige Werkstätten und Wohnstätten GmbH, Femos gGmbH, 1a Zugang Beratungsgesellschaft mbH und die Stiftung Zenit, das Audit des Umweltmanagementsystems (ISO 14001:2015) der GWW im vergangenen November zum Anlass, über die Ausrichtung der Unternehmen in diesem Bereich zu berichten. Wie wollen wir mit unserer Umwelt umgehen?"
589,P_manually,,zwischenbericht,"Es ist wichtig, die Umwelt zu schützen.","Diese Frage stellen sich längst nicht nur Privatpersonen, sondern auch Unternehmen. Denn egal was wir tun, haben wir Verantwortung gegenüber der Umwelt und den uns nachfolgenden Generationen."
590,P_manually,,zwischenbericht,Auch die GWW achtet auf die Umwelt.,"Auch die Unternehmen des Campus Mensch möchten sich darum diesem wichtigen Thema zentral annehmen. Im Leitbild der GWW ist das Thema Umwelt auf höchster Ebene verortet. Dort heißt es: „Wir bieten unseren internen Kunden, Wirtschaftskunden und Leistungsträgern Qualität, Zuverlässigkeit und innovative Lösungen unter Berücksichtigung eines sorgsamen Umgangs mit der Umwelt.“ Es war ein Anliegen aller, die am Leitbildprozess mitgearbeitet haben."
591,P_manually,,zwischenbericht,Die Mitarbeiter der GWW vermeiden Abfall.,"Dazu gehörten verschiedene Menschen des Unternehmens: Menschen mit Behinderung und anderen Nachteilen, Fachkräfte, Leitungen aus allen Bereichen. Doch wie wirkt sich dieser Abschnitt des Leitbilds im Alltag aus? Aus dem Leitbild ist unter anderem das Thema Umwelt als Handlungsfeld abgeleitet: Ein Handlungsfeld wirkt in alle Campus Mensch Unternehmen und es kann in allen Unternehmen Personen geben, die sich um dieses Handlungsfeld kümmern. Allerdings werden diese Themen nur dann gelebt, wenn alle Unternehmensmitglieder sie auch zu ihren Zielen machen."
592,P_manually,,zwischenbericht,Und sie trennen Abfall,"D. h. alle sollten in ihren Handlungen den Aspekt des sorgsamen Umgangs mit der Umwelt bedenken. Auch aus dem wirtschaftlichen Handeln ergeben sich besondere Umweltaspekte, deren Auswirkung auf die Umwelt die GWW so gering wie möglich halten will. Dafür werden die Produktionsanlagen sowie die Gebäude an einer Umweltpolitik ausgerichtet. Was heißt das konkret?"
593,P_manually,,zwischenbericht,und verwerten ihn weiter.,"Alle Aspekte können wir an dieser Stelle nicht nennen, daher wollen wir exemplarisch einige Punkte herausgreifen."
594,P_manually,,zwischenbericht,Sie achten auf den Wasser-Verbrauch.,"Grundsätzlich achten wir darauf, Abfall zu vermeiden, zu trennen und zu recyceln. Der Wasserverbrauch wird genau beobachtet und nach Möglichkeit reduziert."
595,P_manually,,zwischenbericht,An manchen Stand-Orten nutzen sie schon Regen-Wasser.,An verschiedenen Standorten wird zusätzlich Regenwasser genutzt. An den GWW Werkstandorten wird die innerbetriebliche Logistik ab 2022 CO2-neutral durchgeführt werden.
596,P_manually,,zwischenbericht,Spätestens 2030 sollen alle Autos von der GWW elektronisch fahren.,"Auch die externe Logistik wird nach und nach, sobald am Markt verfügbar, auf CO2 freie Antriebe umgestellt. Spätestens im Jahr 2030 soll die Fahrzeugflotte der GWW CO2-neutral sein."
597,P_manually,,zwischenbericht,Für die Elektro-Autos werden schon Lade-Säulen installiert.,Bereits jetzt werden bei Neubauten und auch vereinzelt an bestehenden Immobilien beispielsweise Ladesäulen für Elektroautos installiert.
598,P_manually,,zwischenbericht,"Die Mitarbeiter der GWW achten auch darauf, weniger Strom zu verbrauchen.","Durch Einsparungen und Optimierungen an vorhandenen Anlagen und auch durch die Nutzung selbst erzeugte Energie streben wir eine Reduzierung des Energieverbrauchs von jährlich 2 % an. Dieser Punkt hat den Auditoren besonders gefallen, dass das Thema CO2 Neutralität jetzt verbindlich in die Umweltpolitik aufgenommen wurde."
599,P_manually,,zwischenbericht,"Zum Beispiel durch Lampen, die weniger Strom verbrauchen. Das sind nur ein paar Beispiele,",Über detaillierte Auswertungen kann die aktuelle Entwicklung genauestens beobachtet und bei Bedarf eingegriffen werden.
600,P_manually,,zwischenbericht,wie die GWW auf die Umwelt achtet.,"Außerdem bezieht die GWW 100 % Ökostrom. Darüber hinaus kann jeder im Alltag dazu beitragen, Energie einzusparen, beispielsweise indem unnötig brennende Lampen ausgeschaltet werden."
601,P_manually,,zwischenbericht,Aber auch die anderen Unternehmen,Doch auch die Lampen selbst sollen bis 2025 im Arbeitsbereich komplett gegen energieeffiziente LED-Leuchtmittel ausgetauscht werden.
602,P_manually,,zwischenbericht,"von Campus Mensch achten auf die Umwelt. Jeder kann etwas tun, um die Umwelt zu schützen.",Durch all diese Maßnahmen und durch die Unterstützung aller in den Campusunternehmen tätigen Menschen und den Bewohnern der Wohnbereiche wollen wir uns für einen nachhaltigen Umgang mit der Umwelt einsetzen. Damit wollen wir unsere Ziele im Sinne einer sorgsamen Umweltpolitik erreichen.
603,P_manually,,zwischenbericht,Die GWW hat vor 40 Jahren ihre ersten Wohnheime eröffnet. Ein Wohnheim in Sindelfingen mit 37 Plätzen und ein Wohnheim in Herrenberg mit 36 Plätzen. Jetzt haben sie Jubiläum gefeiert.,Auf eine große Feier mit Gästen mussten die Bewohner der Wohnbereiche der GWW in Sindelfingen und Herrenberg in diesem Jahr verzichten.
604,P_manually,,zwischenbericht,Leider gab es Corona-Schutz-Maßnahmen und deswegen waren keine Gäste eingeladen. Die Bewohner und Betreuer blieben deshalb unter sich.,Aufgrund der aktuellen Corona Schutzmaßnahmen blieben die über 100 Bewohner und Betreuer an den verschiedenen Standorten unter sich.
605,P_manually,,zwischenbericht,Die Feier war aber trotzdem sehr schön. Es gab Fotos aus alten Zeiten und die älteren Bewohner erinnerten sich an früher.,Dies tat der Feier keinen Abbruch – es gab Fotos aus alten Zeiten und die älteren Bewohner erinnerten sich an die unterschiedlichen Begebenheiten und Veränderungen in den vergangenen 40 Jahren.
606,P_manually,,zwischenbericht,Viele Menschen mit Behinderung. in den Werkstätten,Durch die 1980 eingeweihten Wohnheime in Sindelfingen und Herrenberg folgte die GWW dem Wunsch der in den Werkstätten beschäftigten Menschen mit Behinderung. Viele der Mitarbeiter lernten in den Werkstätten über die tägliche Arbeit eine neue Form der Teilhabe kennen.
607,P_manually,,zwischenbericht,"wünschten sich früher, möglichst selbstbestimmt zu wohnen.","In der Folge hatten sie auch den Wunsch, möglichst selbstbestimmt und unabhängig vom Elternhaus wohnen zu können. Darüber hinaus kamen auch viele Angehörige in ein Alter, in dem sie die Betreuung ihrer Angehörigen mit Behinderung daheim nicht mehr leisten konnten."
608,P_manually,,zwischenbericht,Die GWW eröffnete also ihre ersten Wohnheime in Sindelfingen und in Herrenberg.,"So eröffneten die Wohnheime in Sindelfingen mit 37 Plätzen und in Herrenberg mit 36 Plätzen ein Wohnangebot, welches mit einer großen Anzahl Einzelzimmern als richtungsweisend galt."
609,P_manually,,zwischenbericht,Die Selbstständigkeit der Bewohner wurde dabei immer auch gefordert und gefördert.,"Allerdings mussten sowohl die Angehörigen, als auch die Bewohner lernen, dass das Wohnangebot keine Fortführung des bisherigen Familienlebens darstellt. Denn die GWW forderte und förderte immer auch die Selbstständigkeit ihrer Bewohner."
610,P_manually,,zwischenbericht,"Dass das nicht immer für jeden einfach war, erzählt man sich noch heute.","Dass das nicht immer für jeden einfach war, erzählt man sich noch heute."
611,P_manually,,zwischenbericht,Andere Wohnformen kamen bald,"So stellte ein Bewohner kurz nach seinem Einzug fest, dass die Betreuerinnen wohl nicht allzu fleißig seien."
612,P_manually,,zwischenbericht,zu den Wohnheimen dazu.,"Darauf angesprochen erklärte der Bewohner: „Stell dir vor, ich stelle abends meine Schuhe vor die Tür und meinst du, die haben sie bis morgens geputzt?“ Unbeirrt davon hielten die Verantwortlichen an der wachsenden Selbstständigkeit der Bewohner fest."
613,P_manually,,zwischenbericht,Das Ambulant Betreute Wohnen ermöglichte den Bewohnern eine hohe Eigenständigkeit.,"Nur wenige Jahre später wurden weitere Wohnformen umgesetzt, die den Bewohnern hohe Eigenständigkeit gewährte. So erkannte die GWW als eine der ersten Einrichtungen bereits in den achtziger Jahren das Potenzial des Ambulant Betreuten Wohnens."
614,P_manually,,zwischenbericht,Passende Angebote gibt es heute für Menschen mit verschiedenem Hilfebedarf. Auch für ältere Menschen mit Behinderung.,"Heute gibt es für Menschen jeglichen Hilfebedarfs differenziert abgestimmte Angebote, unabhängig von deren Alter. „Die Wohnangebote richten sich immer nach den Wünschen der Bewohner."
615,P_manually,,zwischenbericht,"Britta Bender, die in der GWW das Geschäftsfelds Wohnen leitet, erklärt:","Wer selbstständig leben möchte, soll dies im Rahmen seiner Möglichkeiten tun dürfen“, erklärt Britta Bender, Geschäftsfeldleiterin Wohnen in der GWW. So wurde auch an den anderen Wohnstandorten im Landkreis Böblingen kräftig mitgefeiert."
616,P_manually,,zwischenbericht,„Die Wohnangebote richten sich immer,Denn sie alle gehen auf die Gründung vor 40 Jahren zurück.
617,P_manually,,zwischenbericht,nach den Wünschen der Bewohner.,"Die Bewohner in Herrenberg bemalten Karten, die sie am Nachmittag zeitgleich von allen Standorten aus mit bunten Luftballons in den leider verregneten Himmel steigen ließen."
618,P_manually,,zwischenbericht,"Wer selbstständig leben möchte,","Als die ersten Wohnheime der GWW öffneten, lebten die meisten Menschen mit Behinderung in Deutschland hauptsächlich in Einrichtungen außerhalb der Städte. Heimatnahe Wohnangebote gab es so gut wie nicht. So war es nur konsequent, dass die Verantwortlichen der GWW die Wünsche der Bewohner und Angehörigen weiter verfolgten und die vielfältigen Wohnangebote gemeindeintegriert an vielen Stellen der Städte und Gemeinden im Landkreis entwickelte. „So können heute die Menschen im Wohnheim lernen, ihr Leben mitzugestalten und wer es sich zutraut, alleine zu leben, zieht später in eine Außenwohngruppe und anschließend möglicherweise in die eigene Wohnung“, so Bender weiter. „Und wenn die Menschen später im fortgeschrittenen Alter wieder mehr Hilfe benötigen, können die Betreuungszeiten erhöht werden oder sie können in eine enger betreute Wohnform wechseln.“ Dieses Konzept kommt auch bei den Verantwortlichen der Städte und Gemeinden an. So lobte Herrenbergs Oberbürgermeister Thomas Spißler in seinem Grußwort: „Die GWW setzt sich stets für andere ein und bildet gemeinsam eine großartige Gemeinschaft."
619,P_manually,,zwischenbericht,soll dies so gut er kann auch dürfen.“,Alle Menschen sind willkommen und können Teil dieser Gemeinschaft sein. Das ist etwas ganz Wunderbares und alle tragen zusammen dazu bei.“
620,P_manually,,zwischenbericht,Die Corona-Krise betrifft jeden. Alle Menschen – weltweit.,Es ist nicht zu übersehen: Die Corona-Krise betrifft jeden einzelnen Menschen – weltweit.
621,P_manually,,zwischenbericht,Auch im GWW-Wohnheim Calw.,Auch im Wohnheim Calw ist dies das Gesprächsthema Nummer eins. Alles dreht sich um das Corona-Virus.
622,P_manually,,zwischenbericht,Aber wie gehen wir damit um?,Aber wie gehen wir damit um?
623,P_manually,,zwischenbericht,"Wir haben mit mehreren Menschen aus dem Wohnheim-Umfeld gesprochen. Hier folgt das, was uns die","Wir haben mit mehreren Menschen gesprochen, die bei uns wohnen, arbeiten, mit ehrenamtlichen Helfern, Eltern…usw. Einen Ausschnitt der Antworten stellen wir Ihnen hier vor. Den ausführlichen Bericht lesen Sie in unserer kommenden Ausgabe des Campus Mensch Magazins aktuell."
624,P_manually,,zwischenbericht,Bewohner gesagt haben.,"Der Dank geht an alle, die mit ihren Aussagen zum Bericht beigetragen haben. Zuerst haben wir die Bewohner befragt:"
625,P_manually,,zwischenbericht,Was ist eigentlich das Corona-Virus?,Was ist eigentlich das Corona-Virus?
626,P_manually,,zwischenbericht,"Viele sagten gleich, das ist gefährlich, daran kann man sterben.","Viele sagten gleich, das ist gefährlich, daran kann man sterben."
627,P_manually,,zwischenbericht,Das sieht und hört man nicht.,Das sieht und hört man nicht.
628,P_manually,,zwischenbericht,Das macht die Menschen krank.,Das macht die Menschen krank.
629,P_manually,,zwischenbericht,Wie können wir uns vor ihm schützen?,Wie können wir uns vor ihm schützen?
630,P_manually,,zwischenbericht,Wir waschen unsere Hände. Wir halten Abstand. Wir husten in den Ellenbogen.,"Wir waschen unsere Hände, müssen Abstand voneinander halten, wir husten in den Ellenbogen."
631,P_manually,,zwischenbericht,Und wir bleiben zu Hause.,Wir bleiben zu Hause.
632,P_manually,,zwischenbericht,Wir gehen auch nicht mehr arbeiten oder in den FuB.,Gehen nicht mehr arbeiten oder in den FuB. Hier im Wohnheim sind wir sicher.
633,P_manually,,zwischenbericht,Es soll auch kein Besuch ins Wohnheim kommen.,Es soll auch kein Besuch zu uns ins Wohnheim kommen.
634,P_manually,,zwischenbericht,Wie haltet ihr dann Kontakt zu euren Familien und Freunden?,"Wie könnt ihr dann Kontakt zu euren Familien und Freunden haben, wenn die nicht zu euch kommen dürfen oder ihr auch nicht zu ihnen könnt?"
635,P_manually,,zwischenbericht,Wir können sie leider nicht treffen oder besuchen. Wir können aber jederzeit mit ihnen telefonieren.,"Ja, wir können sie leider nicht treffen oder auch nicht besuchen, aber telefonieren können wir jederzeit mit ihnen."
636,P_manually,,zwischenbericht,Dazu haben wir mehrere Telefone bekommen.,"Unsere Betreuer haben für uns mehrere Telefone bereitgestellt. Die Gemeinde hat uns ein Telefon gebracht, wo man den Gottesdienst mithören kann."
637,P_manually,,zwischenbericht,Wie geht es euch ohne persönlichen Kontakt zu euren Angehörigen und Freunden?,"Wie geht es euch damit, dass ihr keinen persönlichen Kontakt zu euren Angehörigen und Freunden haben könnt?"
638,P_manually,,zwischenbericht,"Schlecht, wir sind sehr traurig und es nervt uns.","Schlecht, wir sind sehr traurig und es nervt uns."
639,P_manually,,zwischenbericht,Alles ist verboten.,Alles ist verboten.
640,P_manually,,zwischenbericht,Aber das geht gerade jedem so.,Aber das geht gerade jedem so.
641,P_manually,,zwischenbericht,Was seht ihr gerade als gut im Wohnheim an?,Was seht ihr gerade als positiv im Wohnheim an?
642,P_manually,,zwischenbericht,Die Betreuer geben sich Mühe.,Die Betreuer geben sich Mühe.
643,P_manually,,zwischenbericht,Sie sind für uns da.,Sie sind für uns da.
644,P_manually,,zwischenbericht,"Es ist schön, dass wir morgens ausschlafen können. Und tagsüber können wir teilnehmen",Morgens kann man ausschlafen.
645,P_manually,,zwischenbericht,an Angeboten wie,"Wir haben Angebote, an denen wir teilnehmen können."
646,P_manually,,zwischenbericht,"Malen, Vorlesen, Basteln oder Gemeinschaftsspielen. Es kommt auch regelmäßig ein Herr zu uns in den Hof, der uns mit der Trompete Lieder vorspielt.","Das ist z.B. Malen, Geschichten vorlesen, Basteln, Gemeinschaftsspiele, es kommt auch regelmäßig ein Herr zu uns in den Hof, der uns mit der Trompete Lieder vorspielt."
647,P_manually,,zwischenbericht,Das ist alles eine tolle Abwechslung und der Tag ist dann nicht so lang.,Das ist alles eine tolle Abwechslung und der Tag ist dann nicht so lang.
648,P_manually,,zwischenbericht,Was wünscht ihr euch für die nächste Zeit?,Was wünscht ihr euch für die nächste Zeit?
649,P_manually,,zwischenbericht,Das Virus soll bald verschwinden.,Das Virus soll bald verschwunden sein.
650,P_manually,,zwischenbericht,Wir wollen wieder arbeiten gehen oder in den FuB. Wir wollen wieder unsere Freunde sehen.,"Dann können wir endlich wieder arbeiten gehen oder in den FuB, wir sehen dann wieder unsere Freunde. Die vermissen wir sehr. Alles soll einfach wieder normal sein."
651,P_manually,,zwischenbericht,Die vermissen wir sehr.,"Als nächstes haben wir Eltern befragt. Die große Gemeinsamkeit sind die Sorgen, die sie sich machen: Hoffentlich bekommt mein Kind nicht das Virus. Außerdem bedauerten sie, dass sie keinen persönlichen Kontakt mehr zu den Bewohnern haben können. Sie verstehen aber das Besuchsverbot und finden es auch gut."
652,P_manually,,zwischenbericht,Alles soll einfach wieder normal sein.,"Das schützt alle Bewohner. Sie sind dankbar, dass wir den telefonischen Kontakt anbieten. Das tut gut und hilft allen Beteiligten in dieser Zeit. Auch die Betreuer sind davon betroffen."
653,P_manually,,zwischenbericht,,"Nicht nur bei der Arbeit, sondern auch daheim."
654,P_manually,,zwischenbericht,,"Viele müssen nicht nur den Alltag der Wohngruppe neu strukturieren, sondern auch den Tagesablauf zuhause, beispielsweise, wenn bei den Kindern Schule oder Kita ausfallen."
655,P_manually,,zwischenbericht,,"Der Dienstplan hat sich geändert, teilweise gibt es längere Arbeitszeiten."
656,P_manually,,zwischenbericht,,"Aber jeder springt ein, wo es nötig ist."
657,P_manually,,zwischenbericht,,"Es ist schön zu sehen, dass die Bewohner sehr hilfsbereit sind, viel Verständnis zeigen und auch geduldiger sind."
658,P_manually,,zwischenbericht,,"Da ich schon lange im Wohnheim arbeite, sind mir die Bewohner lieb und vertraut, berichtet eine Nachtwache."
659,P_manually,,zwischenbericht,,Da ist es mit dem Abstand halten nicht immer leicht oder auch nicht möglich.
660,P_manually,,zwischenbericht,,"Auch nach der Nachtwache ist es daheim anders, da alle zuhause sind."
661,P_manually,,zwischenbericht,,Da kann man dann nur kurz schlafen.
662,P_manually,,zwischenbericht,,"Wir sind in der Nachtwache aber ein tolles Team und jeder springt für den Anderen ein, wenn es nötig ist."
663,P_manually,,zwischenbericht,,Ein FSJ-ler berichtet: „Ich mache momentan ein Freiwilliges Soziales Jahr im Wohnheim Calw-Stammheim.
664,P_manually,,zwischenbericht,,Wir bekommen Unterstützung durch die Betreuer vom FuB.
665,P_manually,,zwischenbericht,,"Schön ist zu erkennen, dass die Bewohner Verständnis zeigen."
666,P_manually,,zwischenbericht,,Besonders die in der Tagbetreuung ausgedachten Ersatzaktivitäten scheinen ihnen sehr zu gefallen.
667,P_manually,,zwischenbericht,,"Ich hoffe zwar, dass die Krise möglichst bald überwunden ist und wir wieder in unser alltägliches Leben zurück können, aber ich weiß, dass wir bei jeder möglichen Dauer der Krise gut organisiert sind.“"
668,P_manually,,zwischenbericht,,Auch unser ehrenamtlicher Trompetenspieler hat uns ein kleines Interview gegeben:
669,P_manually,,zwischenbericht,,Wie geht es ihnen mit der momentanen Situation?
670,P_manually,,zwischenbericht,,"Mit selber geht es gut, jedoch mache ich mir Sorgen um die Menschen, denen es nicht gut geht oder bei denen ein hohes Risiko durch Ansteckung besteht."
671,P_manually,,zwischenbericht,,Wie kamen sie auf die Idee für uns Trompete zu spielen?
672,P_manually,,zwischenbericht,,Der Posaunenchor Stammheim hat schon immer Kontakt zur GWW.
673,P_manually,,zwischenbericht,,Drei Bewohner von den Wohnheimen in Calw-Stammheim kommen regelmäßig zu den Proben des Posaunenchors.
674,P_manually,,zwischenbericht,,"Die Idee in der momentanen Zeit kam durch die Medien, da viele Musiker von ihren Balkonen spielen."
675,P_manually,,zwischenbericht,,Da habe ich mir überlegt ins Wohnheim zu fahren und für die Bewohner und Betreuer hier zu spielen.
676,P_manually,,zwischenbericht,,"Ich spiele in der Mörikestraße und im Gänsäcker (montags, mittwochs und freitags)."
677,P_manually,,zwischenbericht,,"Es ist ein schönes Gefühl zu sehen, wieviel Freude es den Bewohnern macht, die Musik zu hören und auch selber mitzusingen."
678,P_manually,,zwischenbericht,Wie können Menschen mit hohem Unterstützungsbedarf möglichst selbstbestimmt am Leben teilhaben?,"Auch wenn wir nicht sprechen können, haben wir trotzdem etwas zu sagen Eine Tagung in der GWW Herrenberg erörtert Fragen zu selbstbestimmtem Leben für Menschen mit hohem Unterstützungsbedarf"
679,P_manually,,zwischenbericht,Das Institut Mensch Ethik Wissenschaft aus Berlin machte dazu eine wissenschaftliche Studie. Die Wissenschaftler aus Berlin waren auch,"Wie Teilhabe und Selbstbestimmung auch bei Menschen mit hohem Unterstützungsbedarf gelingen können, wird derzeit im Rahmen einer wissenschaftlichen Studie vom Institut Mensch Ethik Wissenschaft (IMEW) in Berlin untersucht."
680,P_manually,,zwischenbericht,bei der GWW in Herrenberg zu einer Tagung. 24 Teilnehmer waren bei der Tagung dabei. Darunter waren 7 Männer und Frauen mit hohem Unterstützungsbedarf.,"Um über wegweisende Umsetzungen zu diskutieren, trafen sich in den Herrenberger Räumen der GWW – Gemeinnützige Werkstätten und Wohnstätten GmbH 24 Teilnehmer, darunter sieben Männer und Frauen mit hohem Unterstützungsbedarf."
681,P_manually,,zwischenbericht,Einige von ihnen nutzten digitale Hilfsmittel.,"Einige von ihnen nutzten digitale Hilfsmittel, um sich an den Gesprächen zu beteiligen und ihre Erfahrungen einzubringen."
682,P_manually,,zwischenbericht,Damit konnten sie an den Gesprächen teilnehmen. Einer von ihnen war Bernd Oberdorfer. Er hat auch sonst schon immer gerne diskutiert.,Bernd Oberdorfer hat sich schon immer in Diskussionen eingemischt.
683,P_manually,,zwischenbericht,"Das war früher aber nicht so einfach, denn er benutzte das Morse-Alphabet.","In der Vergangenheit war das nicht ganz einfach, da er über das Morse Alphabet kommunizierte."
684,P_manually,,zwischenbericht,"Und nur wer das Morse-Alphabet kannte, konnte aus seinen Augen-Bewegungen lesen.","Anhand der Augenbewegung konnte sein Gegenüber, der ebenfalls das Morse Alphabet kennen musste, Buchstabe für Buchstabe ablesen, Wörter zusammensetzen, Sätze und Inhalte erfassen."
685,P_manually,,zwischenbericht,Heute hilft ihm ein digitales Sprachgerät.,"Heute hilft ihm ein digitales Sprachgerät, welches er mithilfe von am Rollstuhl angebrachten Sensoren durch Kopfbewegungen steuern kann."
686,P_manually,,zwischenbericht,Das Sprachgerät erkennt Kopfbewegungen,"So kann er einerseits einprogrammierte Wörter und Sätze nutzen, oder aber seine Nachrichten selbst schreiben."
687,P_manually,,zwischenbericht,über einen Sensor am Rollstuhl.,"Seine Assistentin unterstützt ihn dann, wenn die Technik streikt, eine leidige Erfahrung, welche er mit den anderen Teilnehmern mit Sprachgeräten teilt."
688,P_manually,,zwischenbericht,"Bernd Oberdorfer kann so steuern, was das Sprachgerät sagen soll. Die Teilnehmer mit hohem Hilfebedarf","An der Herrenberger Tagung berichten Oberdorfer und die anderen Teilnehmer mit hohem Unterstützungsbedarf der GWW von ihrer Mitsprache im Unternehmen und von Projekten, in denen sie als Referenten auftreten. Denn die GWW nimmt im institutionellen Rahmen bereits eine Vorreiterrolle ein und macht sich stark für eine verbesserte Lebenssituation dieser Personengruppe."
689,P_manually,,zwischenbericht,haben über ihre Erfahrungen berichtet. Sie berichteten als Experten in eigener Sache.,"Als Experten in eigener Sache können die betroffenen Menschen mitreden, wenn es um sie und um gesellschaftliche Teilhabe und Partizipation geht. Gelungen ist dies durch die Gründung eines eigenständigen Beirats für den Förder- und Betreuungsbereich (FuB). Dieser ergänzt seit April 2015 den bereits bestehenden Werkstatt- und Heimbeirat und setzt sich aus zehn demokratisch gewählten Mitgliedern zusammen."
690,P_manually,,zwischenbericht,"Sie berichteten von Projekten, in denen sie als Redner auftreten.","Dass dies nicht von heute auf morgen umgesetzt werden kann, wird deutlich, wenn man sich die vielfältigen Bildungsangebote anschaut, die während der gemeinsamen Entwicklung entstanden und genutzt wurden."
691,P_manually,,zwischenbericht,"Und sie berichteten davon, wie sie in der GWW mitsprechen können.","Dabei lernten die Beiräte eine Besprechung zu strukturieren, sich abzustimmen und vor allem als Vertreter der im FuB betreuten Menschen zu sprechen. Über Mails können sich die Beiräte im Vorfeld einer Sitzung abstimmen. Kann ein Teilnehmer nicht vor Ort sein, wird er per Live-Video zugeschaltet oder sendet eine Videobotschaft."
